category,brand,name,price,avg_rating,num_ratings
Fragrance,Carolina Herrera,La Bomba Eau de Parfum,$99.00 - $165.00,4.5,289.0
Fragrance,Valentino,Donna Born In Roma Eau de Parfum,$37.00 - $180.00,4.8,6255.0
Fragrance,Sol de Janeiro,Cheirosa 62 Bum Bum Hair & Body Perfume Mist,$26.00 - $39.00,4.7,8751.0
Fragrance,FENTY SKIN body,Allover Body Mist,$35.00,4.5,405.0
Fragrance,Yves Saint Laurent,MYSLF Eau de Parfum,$38.00 - $198.00,4.7,3917.0
Fragrance,Sol de Janeiro,Cheirosa 68 Hair & Body Perfume Mist,$26.00 - $39.00,4.8,2326.0
Fragrance,Sol de Janeiro,Cheirosa 48 Hair & Body Perfume Mist,$26.00 - $39.00,4.7,2876.0
Fragrance,Sol de Janeiro,Cheirosa 40 Hair & Body Perfume Mist,$26.00 - $39.00,4.7,4691.0
Fragrance,Prada,Paradigme Eau de Parfum,$37.00 - $195.00,4.7,1964.0
Fragrance,Carolina Herrera,Good Girl Blush Eau de Parfum,$39.00 - $205.00,4.5,1208.0
Fragrance,Balmain Paris,Destin De Balmain Eau de Parfum,$33.00 - $185.00,4.7,1980.0
Fragrance,Dolce&Gabbana,My Devotion Eau de Parfum Intense,$39.00 - $184.00,4.5,196.0
Fragrance,Yves Saint Laurent,Y Eau de Parfum,$38.00 - $230.00,4.7,4766.0
Fragrance,Burberry,Burberry Goddess Eau de Parfum,$40.00 - $181.00,4.7,2350.0
Fragrance,Billie Eilish,Eilish Eau de Parfum,$30.00 - $82.00,4.4,3597.0
Fragrance,Yves Saint Laurent,Libre Eau de Parfum,$38.00 - $225.00,4.6,5676.0
Fragrance,Dolce&Gabbana,Light Blue Eau de Toilette,$38.00 - $198.00,4.4,200.0
Fragrance,ARMANI,Acqua di Giò Profondo Eau de Parfum,$88.00 - $155.00,4.5,17.0
Fragrance,Yves Saint Laurent,Libre Berry Crush Eau de Parfum,$38.00 - $180.00,4.7,1678.0
Fragrance,Carolina Herrera,Good Girl Jasmine Absolute Eau de Parfum,$39.00 - $184.00,4.6,221.0
Fragrance,Burberry,Her Elixir de Parfum,$40.00 - $190.00,4.6,3148.0
Fragrance,Carolina Herrera,Good Girl Eau de Parfum,$37.00 - $194.00,4.7,2789.0
Fragrance,Lancôme,La Vie Est Belle Eau de Parfum,$35.00 - $164.00,4.7,11508.0
Fragrance,Valentino,Donna Born in Roma Coral Fantasy Eau de Parfum,$37.00 - $180.00,4.8,2104.0
Fragrance,KYLIE COSMETICS,Cosmic Kylie Jenner Intense Eau de Parfum,$29.00 - $86.00,4.5,979.0
Fragrance,Burberry,Her Eau de Parfum,$40.00 - $225.00,4.6,4000.0
Fragrance,Sol de Janeiro,Cheirosa 59 Hair & Body Perfume Mist,$26.00 - $39.00,4.8,434.0
Fragrance,Dior,Sauvage Eau de Parfum,$90.00 - $289.00,4.7,4583.0
Fragrance,KYLIE COSMETICS,Cosmic Kylie Jenner Eau de Parfum,$29.00 - $84.00,4.3,3740.0
Fragrance,Sol de Janeiro,Cheirosa 68 Jelly Perfume Balm,$26.00,4.4,348.0
Fragrance,Yves Saint Laurent,MYSLF Le Parfum,$39.00 - $232.00,4.7,1955.0
Fragrance,Prada,Paradoxe Eau de Parfum,$38.00 - $180.00,4.7,2328.0
Fragrance,Sol de Janeiro,Cheirosa Perfume Mist Discovery Set,$28.00,5.0,29.0
Fragrance,KHLOÉ KARDASHIAN,XO KHLOÉ Eau de Parfum,$32.00 - $80.00,4.4,1150.0
Fragrance,Sol de Janeiro,Cheirosa 40 Jelly Perfume Balm,$26.00,4.5,341.0
Fragrance,Sol de Janeiro,Cheirosa 62 Jelly Perfume Balm,$26.00,4.5,355.0
Fragrance,Saltair,Fine Fragrance Body Mist,$17.00,4.2,790.0
Fragrance,Prada,Paradoxe Intense Eau De Parfum,$40.00 - $185.00,4.6,992.0
Fragrance,Dior,Sauvage Elixir,$199.00 - $330.00,4.6,4577.0
Fragrance,ARMANI,Emporio Armani Power of You Eau de Parfum,$78.00 - $138.00,4.6,1512.0
Fragrance,BETTER WORLD FRAGRANCE HOUSE,Summer Mink Eau de Parfum,$38.00 - $152.00,4.6,522.0
Fragrance,Yves Saint Laurent,Libre Eau de Parfum Intense,$40.00 - $185.00,4.8,1479.0
Fragrance,Gucci,Flora Gorgeous Gardenia Eau de Parfum,$40.00 - $181.00,4.6,4752.0
Fragrance,Ariana Grande,Cloud Eau de Parfum,$28.00 - $72.00,4.3,3292.0
Fragrance,Valentino,Donna Born in Roma Purple Melancholia Eau de Parfum,$110.00 - $180.00,4.6,1745.0
Fragrance,Valentino,Born in Roma Donna Extradose Parfum,$40.00 - $205.00,4.8,1891.0
Fragrance,Valentino,Uomo Born in Roma Purple Melancholia Eau de Toilette,$110.00 - $136.00,4.7,1593.0
Fragrance,ARMANI,Acqua di Giò Eau de Toilette,$62.00 - $175.00,4.7,4368.0
Fragrance,OUAI,St. Barts Hair & Body Mist,$28.00 - $38.00,4.7,1267.0
Fragrance,CHANEL,COCO MADEMOISELLE Eau de Parfum Spray,$154.00 - $185.00,4.5,421.0
Fragrance,Marc Jacobs,Perfect Eau de Parfum,$37.00 - $165.00,4.6,3203.0
Fragrance,CHANEL,CHANCE EAU TENDRE Eau de Parfum Spray,$115.00 - $185.00,4.4,320.0
Fragrance,Kitsch,Hair Perfume Fragrance Spray,$20.00,4.6,2450.0
Fragrance,Versace,Bright Crystal Eau de Toilette,$38.00 - $179.00,4.6,1390.0
Fragrance,CHANEL,BLEU DE CHANEL Eau de Parfum Spray,$135.00 - $211.00,4.7,140.0
Fragrance,Billie Eilish,Your Turn II Eau de Parfum,$30.00 - $90.00,4.9,368.0
Fragrance,Valentino,Donna Born in Roma Intense Eau de Parfum,$39.00 - $185.00,4.8,2655.0
Fragrance,Sol de Janeiro,Cheirosa 87 Hair & Body Perfume Mist,$26.00 - $39.00,4.6,2204.0
Fragrance,Yves Saint Laurent,Black Opium Eau de Parfum,$37.00 - $172.00,4.7,7561.0
Fragrance,Valentino,Uomo Born in Roma Intense Eau de Parfum,$132.00 - $160.00,4.7,1969.0
Fragrance,Valentino,Donna Born in Roma Green Stravaganza Eau de Parfum,$37.00 - $180.00,4.7,2026.0
Fragrance,Sol de Janeiro,Cheirosa 76 Hair & Body Perfume Mist,$26.00 - $39.00,4.6,1522.0
Fragrance,Sabrina Carpenter,Sweet Tooth Lemon Pie Eau de Parfum,$20.00 - $55.00,4.4,273.0
Fragrance,Dior,Miss Dior Eau de Parfum,$115.00 - $225.00,4.6,9774.0
Fragrance,KHLOÉ KARDASHIAN,ALMOST ALWAYS Eau de Parfum,$32.00 - $80.00,4.6,675.0
Fragrance,Valentino,Uomo Born In Roma Eau de Toilette,$110.00 - $168.00,4.7,3679.0
Fragrance,Dior,Miss Dior Blooming Bouquet Eau de Toilette,$98.00 - $188.00,4.6,7777.0
Fragrance,Burberry,Her Eau de Parfum Intense,$118.00 - $190.00,4.6,4000.0
Fragrance,Yves Saint Laurent,MYSLF Absolu,$42.00 - $210.00,4.8,1727.0
Fragrance,Jimmy Choo,I Want Choo With Love Eau de Parfum,$35.00 - $150.00,4.6,684.0
Fragrance,Donna Karan,Cashmere Mist Deodorant,$32.00,4.6,784.0
Fragrance,Dior,Sauvage Parfum,$110.00 - $347.00,4.7,4583.0
Fragrance,Dior,Sauvage Eau de Toilette,$71.00 - $249.00,4.7,7115.0
Fragrance,Sol de Janeiro,Cheirosa 71 Hair & Body Perfume Mist,$26.00 - $39.00,4.6,6498.0
Fragrance,Miu Miu,Miutine Eau de Parfum,$37.00 - $172.00,4.6,3105.0
Fragrance,NOYZ,Only Human Eau De Parfum,$38.00 - $85.00,4.7,901.0
Fragrance,Jimmy Choo,I Want Choo Le Parfum,$40.00 - $170.00,4.6,1023.0
Fragrance,Dolce&Gabbana,Light Blue Pour Homme Eau de Toilette,$38.00 - $182.00,4.5,120.0
Fragrance,Lancôme,Idôle Eau de Parfum,$34.00 - $157.00,4.6,15018.0
Fragrance,ARMANI,Emporio Armani Stronger With You Intensely Eau de Parfum,$35.00 - $130.00,4.7,2186.0
Fragrance,Nemat,Amber Fragrance Oil Roll-On,$20.99,3.9,789.0
Fragrance,Yves Saint Laurent,Y Iced Cologne Eau de Toilette Intense,$35.00 - $155.00,4.8,1483.0
Fragrance,Dior,J'adore Eau de Parfum,$115.00 - $225.00,4.7,1453.0
Fragrance,Ariana Grande,MOD Vanilla Eau de Parfum Spray,$28.00 - $72.00,4.3,1006.0
Fragrance,ARMANI,Acqua di Gioia Eau de Parfum,$36.00 - $140.00,4.6,1506.0
Fragrance,Yves Saint Laurent,Mon Paris Eau de Parfum,$36.00 - $162.00,4.7,5071.0
Fragrance,Sol de Janeiro,Cheirosa 39 Hair & Body Perfume Mist,$26.00,4.6,4868.0
Fragrance,Dior,Miss Dior Parfum,$122.00 - $225.00,4.7,1730.0
Fragrance,Jean Paul Gaultier,Le Male Elixir Parfum,$40.00 - $178.00,4.6,1526.0
Fragrance,Lancôme,La Vie Est Belle Vanille Nude Eau de Parfum,$36.00 - $168.00,4.8,606.0
Fragrance,Azzaro,The Most Wanted Eau de Parfum Intense,$35.00 - $135.00,4.7,4029.0
Fragrance,Jean Paul Gaultier,Le Male Le Parfum,$37.00 - $160.00,4.6,692.0
Fragrance,NOYZ,Rinse Cycle Eau de Parfum,$38.00 - $85.00,4.3,16.0
Fragrance,Miu Miu,Fleur de Lait Eau de Parfum,$37.00 - $172.00,4.7,2584.0
Fragrance,Versace,Crystal Emerald Eau de Parfum,$38.00 - $148.00,3.7,26.0
Fragrance,Valentino,Uomo Born In Roma Coral Fantasy Eau de Toilette,$110.00 - $136.00,4.7,1302.0
Fragrance,Snif,Milk + Cereal Layering Bundle,$79.00,4.3,7.0
Fragrance,Marc Jacobs,Daisy Wild Eau de Parfum,$37.00 - $165.00,4.5,1072.0
Fragrance,Ralph Lauren,Ralph's Club New York Eau de Parfum,$35.00 - $140.00,4.8,914.0
Fragrance,Versace,Dylan Purple Pour Femme Eau de Parfum,$38.00 - $148.00,3.9,355.0
Fragrance,CHANEL,CHANCE EAU SPLENDIDE Eau de Parfum Spray,$115.00 - $185.00,4.7,582.0
Fragrance,NOYZ,Only Human Mylk de Parfum,$95.00,4.8,80.0
Fragrance,Lancôme,La Vie Est Belle L'Elixir Eau de Parfum,$36.00 - $172.00,4.7,392.0
Fragrance,Gucci,Flora Gorgeous Orchid Eau de Parfum,$40.00 - $181.00,4.7,2433.0
Fragrance,Moroccanoil,L'Originale Eau de Parfum,$35.00 - $142.00,4.4,60.0
Fragrance,Carolina Herrera,Bad Boy Cobalt Eau de Parfum,$39.00 - $160.00,4.6,434.0
Fragrance,DAISE,Fragrance Body Mist,$6.99,4.5,480.0
Fragrance,Valentino,Born in Roma Uomo Extradose Parfum,$145.00 - $185.00,4.7,1695.0
Fragrance,Lancôme,Idôle Peach 'N Roses Eau de Parfum,$34.00 - $149.00,4.5,566.0
Fragrance,Squishmallows Fragrances,Pink Possibilities,$25.00 - $58.00,4.5,145.0
Fragrance,Marc Jacobs,Daisy Eau de Toilette,$37.00 - $195.00,4.7,6792.0
Fragrance,Nemat,Vanilla Musk Fragrance Oil Roll-On,$20.99,4.4,215.0
Fragrance,Yves Saint Laurent,Y Eau de Toilette,$115.00 - $136.00,4.8,2923.0
Fragrance,Viktor&Rolf,Flowerbomb Eau de Parfum,$35.00 - $245.00,4.8,10374.0
Fragrance,Jimmy Choo,I Want Choo Eau de Parfum,$35.00 - $150.00,4.5,2322.0
Fragrance,FENTY SKIN body,Allover Body Mist Mini,$20.00,4.5,53.0
Fragrance,Jean Paul Gaultier,Le Beau Eau de Toilette,$37.00 - $138.00,4.6,407.0
Fragrance,ARMANI,My Way Eau de Parfum,$37.00 - $170.00,4.7,9517.0
Fragrance,Carolina Herrera,Very Good Girl Eau de Parfum,$39.00 - $184.00,4.4,503.0
Fragrance,Carolina Herrera,Good Girl Blush Elixir,$112.00 - $192.00,4.3,388.0
Fragrance,Nemat,Amber Eau de Parfum,$20.99 - $59.99,3.3,258.0
Fragrance,Jean Paul Gaultier,Le Beau Le Parfum,$40.00 - $169.00,4.5,10.0
Fragrance,CHANEL,COCO MADEMOISELLE Eau de Parfum Intense Spray,$162.00 - $195.00,4.5,160.0
Fragrance,Dior,J'adore Intense Parfum,$122.00 - $184.00,4.7,1306.0
Fragrance,CHANEL,CHANCE EAU FRAÎCHE Eau de Parfum Spray,$115.00 - $185.00,4.4,46.0
Fragrance,Jean Paul Gaultier,Le Beau Paradise Garden Eau de Parfum,$37.00 - $159.00,4.5,331.0
Fragrance,Carolina Herrera,Very Good Girl Glam Eau de Parfum,$39.00 - $184.00,4.4,590.0
Fragrance,Coach,Floral Eau de Parfum,$35.00 - $129.00,4.5,1897.0
Fragrance,Gucci,Flora Gorgeous Gardenia Eau de Parfum Intense,$40.00 - $190.00,4.7,791.0
Fragrance,Azzaro,The Most Wanted Parfum,$120.00 - $145.00,4.7,4029.0
Fragrance,Yves Saint Laurent,Men's Mini Cologne Duo Set,$40.00,3.5,25.0
Fragrance,Marc Jacobs,Perfect Absolute Eau de Parfum,$37.00 - $170.00,4.5,760.0
Fragrance,Rabanne,1 Million Lucky Eau de Toilette,$126.00,4.6,453.0
Fragrance,Beauty Finds by ULTA Beauty,Her Signature Scents,$24.00,,
Fragrance,Dolce&Gabbana,Devotion Eau de Parfum,$38.00 - $147.00,4.2,448.0
Fragrance,Yves Saint Laurent,Libre Flower & Flames Eau de Parfum Florale,$38.00 - $180.00,4.7,1848.0
Fragrance,Carolina Herrera,Bad Boy Cobalt Absolute Eau de Parfum,$39.00 - $168.00,4.7,151.0
Fragrance,Marc Jacobs,Perfect and Daisy Wild 2-Piece Mini Gift Set,$34.00,4.6,58.0
Fragrance,Marc Jacobs,Daisy Love Eau de Toilette,$32.00 - $142.00,4.7,6792.0
Fragrance,Clinique,Clinique Happy Eau de Parfum Spray,$48.75 - $81.00,4.7,1835.0
Fragrance,CHANEL,BLEU DE CHANEL Parfum Spray,$168.00 - $210.00,4.8,25.0
Fragrance,Marc Jacobs,Daisy Eau So Fresh Eau de Toilette,$37.00 - $160.00,4.7,11215.0
Fragrance,Jean Paul Gaultier,La Belle Paradise Garden Eau de Parfum,$36.00 - $166.00,4.4,572.0
Fragrance,Moroccanoil,Lumière du Jour Eau de Parfum,$35.00 - $105.00,4.8,151.0
Fragrance,Burberry,Burberry 2-Piece Mini Perfume Gift Set,$39.00,4.2,16.0
Fragrance,Yves Saint Laurent,Y Le Parfum,$39.00 - $196.00,4.8,1776.0
Fragrance,KYLIE COSMETICS,Cosmic Kylie Jenner 2.0 Eau de Parfum,$29.00 - $84.00,4.4,1125.0
Fragrance,Vacation,Body Mist by Vacation,$24.00,4.4,751.0
Fragrance,ARMANI,Giorgio Armani Stronger With You Powerfully Eau de Parfum,$35.00 - $130.00,4.8,1023.0
Fragrance,Rabanne,1 Million Elixir,$168.00,4.6,922.0
Fragrance,Marc Jacobs,Daisy Love Eau So Sweet Eau de Toilette,$82.00 - $142.00,4.7,737.0
Fragrance,Juicy Couture,Viva La Juicy Eau de Parfum,$33.00 - $129.00,4.6,3059.0
Fragrance,NOYZ,Unmute Eau de Parfum,$38.00 - $85.00,4.5,872.0
Fragrance,Burberry,Her Parfum,$40.00 - $199.00,4.6,741.0
Fragrance,Versace,Eros Eau de Toilette,$94.00 - $160.00,4.7,508.0
Fragrance,Yves Saint Laurent,Libre Eau de Parfum Mini Duo Set,$40.00,4.3,50.0
Fragrance,Dior,Miss Dior Essence,$134.00 - $198.00,4.7,1381.0
Fragrance,CHANEL,CHANCE EAU TENDRE Eau de Toilette Spray,$124.00 - $155.00,4.7,143.0
Fragrance,Chloé,Chloé Eau de Parfum,$40.00 - $181.00,4.5,2274.0
Fragrance,Jean Paul Gaultier,Gaultier Divine Eau de Parfum,$36.00 - $173.00,4.5,2062.0
Fragrance,NOYZ,Detour Mylk de Parfum,$95.00,4.7,67.0
Fragrance,Coach,For Men Eau de Toilette,$37.00 - $134.00,4.8,268.0
Fragrance,Gucci,Gucci Flora Gorgeous Eau de Parfum for Women Duo Gift Set,$42.00,4.8,55.0
Fragrance,Valentino,Valentino Donna Born in Roma Eau de Parfum Travel Gift Set,$50.00,3.0,65.0
Fragrance,Yves Saint Laurent,Black Opium Le Parfum,$118.00 - $205.00,4.6,1886.0
Fragrance,Beauty Finds by ULTA Beauty,His Everyday Scents,$34.00,,
Fragrance,Rabanne,1 Million Eau de Toilette,$35.00 - $172.00,4.5,1004.0
Fragrance,Burberry,Burberry Goddess Parfum,$40.00 - $199.00,4.7,778.0
Fragrance,Dolce&Gabbana,Light Blue Capri In Love Eau de Parfum,$147.00 - $179.00,4.2,123.0
Fragrance,Dolce&Gabbana,The One Eau de Parfum Intense,$39.00 - $177.00,4.5,103.0
Fragrance,Sol de Janeiro,SOL Cheirosa '62 Eau de Parfum,$28.00 - $80.00,4.7,5500.0
Fragrance,Dolce&Gabbana,The One for Men Eau de Parfum,$38.00 - $185.00,4.6,401.0
Fragrance,Dior,J'adore Parfum D'eau Eau de Parfum,$115.00 - $180.00,4.6,3853.0
Fragrance,Prada,Paradoxe Virtual Flower Eau de Parfum,$38.00 - $180.00,4.6,490.0
Fragrance,Sol de Janeiro,Sundays in Rio Warm Vanilla Perfume Mist,$18.20,4.3,59.0
Fragrance,Givenchy,Irresistible Eau de Parfum,$55.00 - $189.00,4.7,4451.0
Fragrance,Dolce&Gabbana,Devotion For Men Parfum,$39.00 - $190.00,4.5,174.0
Fragrance,Marc Jacobs,Daisy Wild Eau So Extra Eau de Parfum,$37.00 - $165.00,4.4,725.0
Fragrance,Versace,Bright Crystal Absolu Eau de Parfum,$128.00 - $148.00,4.7,197.0
Fragrance,Nemat,Vanilla Musk Eau de Parfum,$20.99 - $59.99,3.7,133.0
Fragrance,Rabanne,Million Gold for Her Eau de Parfum,$37.00 - $177.00,4.7,556.0
Fragrance,Dolce&Gabbana,Mini Travel Set Female,$50.00,5.0,3.0
Fragrance,Rabanne,Invictus Victory Elixir Parfum Intense,$138.00 - $176.00,4.6,300.0
Fragrance,CHANEL,N°5 Eau de Parfum Spray,$118.00 - $190.00,4.2,167.0
Fragrance,Philosophy,Fresh Cream Silk Cloud Eau de Parfum,$29.00 - $64.00,4.7,460.0
Fragrance,Snif,2% Eau de Toilette,$68.00,4.7,173.0
Fragrance,Versace,Crystal Noir Eau de Toilette,$78.00 - $110.00,4.5,344.0
Fragrance,Yves Saint Laurent,Black Opium Eau de Parfum Over Red,$99.00 - $172.00,4.7,1841.0
Fragrance,Burberry,Burberry Goddess Eau de Parfum Intense,$40.00 - $190.00,4.7,1729.0
Fragrance,Valentino,Uomo Born In Roma Green Stravaganza Eau De Toilette,$110.00 - $136.00,4.7,1872.0
Fragrance,Beauty Finds by ULTA Beauty,Scents For Her,$24.00,,
Fragrance,Jimmy Choo,Man Aqua Eau de Toilette,$38.00 - $120.00,4.7,462.0
Fragrance,Billie Eilish,Your Turn Eau de Parfum,$30.00 - $90.00,4.6,425.0
Fragrance,Rabanne,Fame in Love Parfum Elixir,$35.00 - $158.00,4.5,206.0
Fragrance,Snif,Coco Shimmy Eau de Toilette,$26.00 - $68.00,4.8,1021.0
Fragrance,NOYZ,Detour Eau de Parfum,$38.00 - $85.00,4.7,606.0
Fragrance,Nemat,Amber Fragrance Oil,$20.99,3.9,355.0
Fragrance,Gucci,Bloom Eau de Parfum,$40.00 - $168.00,4.5,5135.0
Fragrance,Gucci,Guilty Pour Homme Eau de Parfum,$37.00 - $205.00,4.5,2537.0
Fragrance,Nemat,Vanilla Musk Fragrance Oil,$20.99,4.3,467.0
Fragrance,Viktor&Rolf,Flowerbomb Pretty Peony Eau de Parfum,$35.00 - $182.00,4.8,775.0
Fragrance,Marc Jacobs,Perfect Elixir Eau de Parfum,$37.00 - $170.00,4.5,755.0
Fragrance,Versace,Eros Eau de Parfum,$139.00 - $190.00,4.6,504.0
Fragrance,Ariana Grande,Cloud Pink Eau de Parfum,$28.00 - $72.00,4.2,734.0
Fragrance,Gucci,Flora Gorgeous Magnolia Eau de Parfum,$40.00 - $225.00,4.7,1172.0
Fragrance,ARMANI,Acqua di Giò Parfum,$98.00 - $182.00,5.0,22.0
Fragrance,Ariana Grande,Sweet Like Candy Eau de Parfum,$28.00 - $72.00,4.5,1109.0
Fragrance,Coach,Dreams Sunset Eau de Parfum,$35.00 - $124.00,4.6,1025.0
Fragrance,Squishmallows Fragrances,Whisked Away,$25.00 - $58.00,4.6,156.0
Fragrance,Squishmallows Fragrances,3-Piece Coffret Set,$40.00,3.3,74.0
Fragrance,Burberry,Hero Eau de Parfum,$37.00 - $205.00,4.5,2161.0
Fragrance,Carolina Herrera,Very Good Girl Elixir Eau de Parfum,$39.00 - $192.00,4.7,534.0
Fragrance,Prada,Candy Eau de Parfum,$38.00 - $162.00,4.7,7078.0
Fragrance,Ellis Brooklyn,VANILLA SALT Eau de Parfum,$33.00 - $115.00,4.6,124.0
Fragrance,FENTY SKIN body,Lil’ Mists Mini Body Mist Duo,$30.00,4.2,34.0
Fragrance,Marc Jacobs,Daisy Wild Eau So Intense Eau de Parfum,$37.00 - $165.00,4.5,824.0
Fragrance,Versace,Eros Flame Eau de Parfum,$109.00 - $139.00,4.4,430.0
Fragrance,Gucci,Guilty Essence Eau de Toilette,$112.00 - $189.00,4.5,491.0
Fragrance,Versace,Yellow Diamond Eau de Toilette,$38.00 - $128.00,4.6,437.0
Fragrance,Coach,Dreams Starlight Eau de Parfum,$35.00 - $124.00,4.6,514.0
Fragrance,Versace,Man Eau Fraiche Eau de Toilette,$94.00 - $160.00,4.7,662.0
Fragrance,Ralph Lauren,Polo 67 Eau de Parfum,$35.00 - $130.00,4.7,1662.0
Fragrance,Burberry,Her Eau de Toilette,$122.00 - $155.00,4.4,719.0
Fragrance,Coach,Love Eau de Parfum,$35.00 - $129.00,4.6,636.0
Fragrance,MUGLER,Alien Eau de Parfum,$37.00 - $185.00,4.7,3052.0
Fragrance,amika,Amika:Aura Hair And Body Mist,$28.00,4.8,121.0
Fragrance,Gucci,Guilty Love Edition Eau de Parfum for Women,$150.00 - $181.00,4.6,514.0
Fragrance,Moroccanoil,Hair & Body Fragrance Mist,$20.00 - $35.00,4.7,57.0
Fragrance,Bridgerton,Dearest Graceful Hydrangea Eau de Parfum,$19.50 - $45.00,4.4,78.0
Fragrance,Prada,Mini Paradoxe Discovery Set,$42.00,4.4,17.0
Fragrance,Jimmy Choo,I Want Choo Forever Eau de Parfum,$35.00 - $150.00,4.7,1809.0
Fragrance,CHANEL,CHANCE Eau de Parfum Spray,$154.00 - $185.00,4.4,73.0
Fragrance,Gucci,Flora Gorgeous Jasmine Eau de Parfum,$40.00 - $181.00,4.4,2100.0
Fragrance,Jimmy Choo,Man Eau de Toilette,$38.00 - $144.00,4.8,335.0
Fragrance,Gucci,Guilty Pour Homme Eau de Toilette,$112.00 - $137.00,4.6,1784.0
Fragrance,Yves Saint Laurent,Y Eau de Parfum Intense,$150.00 - $180.00,4.7,2896.0
Fragrance,Calvin Klein,Euphoria Magnetic Elixir Parfum Intense,$36.00 - $129.00,4.8,510.0
Fragrance,Philosophy,Fresh Cream Warm Cashmere Eau de Toilette,$28.00 - $58.00,4.6,18798.0
Fragrance,Yves Saint Laurent,Feminine Fragrance Must-Haves,$38.00,3.9,120.0
Fragrance,Dolce&Gabbana,Dolce Magnolia Eau de Parfum,$38.00 - $152.00,4.2,99.0
Fragrance,Versace,Dylan Blue Eau de Toilette,$94.00 - $120.00,4.6,244.0
Fragrance,Ralph Lauren,Romance Eau de Parfum,$35.00 - $160.00,4.7,4855.0
Fragrance,Burberry,Hero Eau de Toilette,$116.00 - $180.00,4.4,582.0
Fragrance,Bridgerton,Dearest Tempting Peach Eau de Parfum,$19.50 - $45.00,4.2,79.0
Fragrance,Dior,J'adore L'Or,$142.00 - $246.00,4.6,2030.0
Fragrance,Ariana Grande,r.e.m. Cherry Eclipse Eau de Parfum,$28.00 - $72.00,4.5,475.0
Fragrance,Moroccanoil,Lumière du Jour Eau de Parfum 2-Piece Gift Set,$105.00,4.7,6.0
Fragrance,CHANEL,BLEU DE CHANEL Eau de Toilette Spray,$115.00 - $180.00,4.8,49.0
Fragrance,Rabanne,Invictus Eau de Toilette,$35.00 - $130.00,4.7,930.0
Fragrance,Sam Edelman,Duet Eau de Parfum,$32.00 - $112.00,4.3,26.0
Fragrance,Versace,Pour Homme Eau de Toilette,$94.00 - $160.00,4.8,621.0
Fragrance,Vacation,"""VACATION"" by Vacation Eau de Toilette",$60.00,4.4,1895.0
Fragrance,Squishmallows Fragrances,Moonlit Mist,$25.00 - $58.00,4.1,152.0
Fragrance,ARMANI,Armani Code Parfum,$100.00 - $198.00,4.8,2661.0
Fragrance,NOYZ,Unmute Mylk de Parfum,$95.00,4.7,57.0
Fragrance,Jimmy Choo,Man Intense Eau de Toilette,$128.00,4.7,70.0
Fragrance,Prada,Luna Rossa Black Eau de Parfum,$150.00 - $155.00,4.3,1031.0
Fragrance,Bridgerton,Dearest Rebel Vanilla Eau de Parfum,$19.50 - $45.00,4.2,66.0
Fragrance,Philosophy,Amazing Grace Eau de Toilette,$28.00 - $88.00,4.6,18798.0
Fragrance,Kopari Beauty,Paradiso Sun Juice Body Mist Sunscreen SPF 30,$20.00,4.7,72.0
Fragrance,Dolce&Gabbana,Light Blue Eau De Parfum,$38.00 - $179.00,4.5,113.0
Fragrance,Coach,Man Blue Eau de Toilette,$37.00 - $116.00,4.8,166.0
Fragrance,Orebella,ETERNAL ROOTS Parfum,$35.00 - $100.00,4.6,288.0
Fragrance,Yves Saint Laurent,Libre Le Parfum,$40.00 - $205.00,4.6,2597.0
Fragrance,ARMANI,Acqua di Gioia Eau de Parfum Intense,$36.00 - $140.00,4.6,229.0
Fragrance,Touchland,Lush Tropicale Body & Hair Fragrance Mist,$20.00,4.4,334.0
Fragrance,Snif,Me Eau de Toilette,$26.00 - $68.00,4.8,1264.0
Fragrance,Orebella,SALTED MUSE Parfum,$35.00 - $100.00,4.6,1382.0
Fragrance,Coach,Coach Gold Parfum,$37.00 - $138.00,4.6,528.0
Fragrance,Billie Eilish,Eilish No. 2 Eau de Parfum,$30.00 - $82.00,3.9,956.0
Fragrance,Yves Saint Laurent,Libre L'Eau Nue Parfum,$36.00 - $155.00,4.6,1133.0
Fragrance,Dior,Addict Rosy Glow Eau de Parfum,$98.00 - $150.00,4.5,358.0
Fragrance,Gucci,Guilty Pour Femme Eau de Toilette,$40.00 - $155.00,4.3,1906.0
Fragrance,Carolina Herrera,Good Girl Blush Eau de Parfum Perfume Gift Set,$109.00,4.5,1208.0
Fragrance,TOM FORD,Ombré Leather Eau de Parfum,$55.00 - $240.00,4.4,2319.0
Fragrance,Dolce&Gabbana,Devotion Eau de Parfum Intense,$39.00 - $184.00,4.3,133.0
Fragrance,Donna Karan,Cashmere Mist Aluminum-Free Deodorant,$32.00,2.7,119.0
Fragrance,Calvin Klein,Euphoria Solar Elixir Parfum Intense,$36.00 - $129.00,4.6,527.0
Fragrance,Ralph Lauren,Beyond Romance Eau de Parfum,$115.00 - $140.00,4.6,2527.0
Fragrance,MUGLER,Angel Eau de Parfum,$37.00 - $195.00,4.4,1958.0
Fragrance,Versace,Eros Parfum,$170.00,4.6,348.0
Fragrance,Dior,Sauvage Eau Forte Parfum,$168.00 - $199.00,4.6,1605.0
Fragrance,Valentino,Uomo Born In Roma Yellow Dream Eau de Toilette,$136.00,4.7,301.0
Fragrance,Valentino,Voce Viva Eau de Parfum,$108.00 - $180.00,4.6,3044.0
Fragrance,Prada,Luna Rossa Ocean Eau de Toilette,$34.00 - $165.00,4.7,3192.0
Fragrance,Coach,Coach for Men Eau de Parfum,$95.00 - $130.00,4.6,453.0
Fragrance,Versace,Eros Energy Eau De Parfum,$109.00 - $139.00,4.4,25.0
Fragrance,CHANEL,CHANCE EAU FRAÎCHE Eau de Toilette Spray,$124.00 - $155.00,4.5,123.0
Fragrance,Carolina Herrera,Bad Boy Eau de Toilette,$35.00 - $131.00,4.6,567.0
Fragrance,MUGLER,Angel Nova Eau de Parfum,$35.00 - $159.00,4.4,1978.0
Fragrance,Lake & Skye,11 11 Eau de Parfum,$36.00 - $148.00,4.4,1309.0
Fragrance,Prada,Luna Rossa Carbon Eau de Toilette,$108.00 - $136.00,4.5,803.0
Fragrance,Ariana Grande,MOD Blush Eau de Parfum Spray,$50.00 - $72.00,4.3,328.0
Fragrance,ARMANI,Emporio Armani Stronger with You Absolutely,$110.00 - $135.00,4.8,943.0
Fragrance,Dolce&Gabbana,The Only One Eau de Parfum,$112.00 - $147.00,4.5,198.0
Fragrance,Snif,Frooty Call Body Mist,$24.00 - $38.00,4.8,128.0
Fragrance,Touchland,Vanilla Velvet Body & Hair Fragrance Mist,$20.00,4.4,334.0
Fragrance,Orebella,NIGHTCAP Parfum,$35.00 - $100.00,3.7,326.0
Fragrance,Rabanne,Invictus Parfum,$157.00,4.5,238.0
Fragrance,Jean Paul Gaultier,Le Male Eau de Toilette,$132.00,4.5,307.0
Fragrance,Viktor&Rolf,Flowerbomb Extreme Eau de Parfum,$35.00 - $187.00,4.7,1358.0
Fragrance,Orebella,BLOOMING FIRE Parfum,$35.00 - $100.00,4.6,635.0
Fragrance,Jean Paul Gaultier,Gaultier Divine Le Parfum,$39.00 - $193.00,4.5,297.0
Fragrance,Ralph Lauren,Ralph Eau de Toilette,$103.00,4.7,4783.0
Fragrance,Carolina Herrera,Bad Boy Cobalt Elixir,$144.00 - $182.00,4.3,254.0
Fragrance,Clinique,Happy Heart Perfume Spray,$48.75 - $81.00,4.8,635.0
Fragrance,Touchland,Peachy Lychee Body & Hair Fragrance Mist,$20.00,4.4,334.0
Fragrance,Philosophy,Fresh Cream Soft Velvet Eau de Toilette,$28.00 - $58.00,4.6,568.0
Fragrance,Versace,Dylan Blue Pour Femme Eau de Parfum,$38.00 - $148.00,4.5,237.0
Fragrance,TOM FORD,Soleil Neige Eau de Parfum,$55.00 - $240.00,4.9,10.0
Fragrance,Calvin Klein,Euphoria Bold Elixir Parfum Intense,$36.00 - $129.00,4.7,535.0
Fragrance,Ralph Lauren,Polo 67 Eau de Toilette,$35.00 - $116.00,4.8,1472.0
Fragrance,MUGLER,Alien Goddess Eau de Parfum,$37.00 - $185.00,4.6,4400.0
Fragrance,Orebella,JASMINE BLUES Parfum,$100.00,4.7,117.0
Fragrance,Dolce&Gabbana,The One Eau de Parfum,$147.00 - $165.00,4.7,276.0
Fragrance,Montblanc,Explorer Eau de Parfum,$37.00 - $136.00,4.8,360.0
Fragrance,Prada,Paradoxe Radical Essence Parfum,$41.00 - $205.00,4.5,1124.0
Fragrance,Burberry,Hero Parfum,$163.00 - $238.00,4.5,789.0
Fragrance,Valentino,Donna Born In Roma Yellow Dream Eau de Parfum,$180.00,4.7,452.0
Fragrance,CHANEL,BLEU DE CHANEL L'EXCLUSIF,$205.00 - $275.00,4.8,899.0
Fragrance,ARMANI,Acqua Di Giò Elixir,$160.00,4.8,980.0
Fragrance,LE MONDE GOURMAND,Lait de Coco Eau de Parfum,$28.00,4.4,139.0
Fragrance,Gucci,Guilty Love Edition Eau de Parfum for Men,$137.00 - $165.00,4.4,474.0
Fragrance,Marc Jacobs,Daisy Ever So Fresh Eau de Parfum,$37.00 - $182.00,4.7,11215.0
Fragrance,Gucci,Flora Gorgeous Gardenia Eau de Parfum Duo Gift Set,$116.00,4.6,4752.0
Fragrance,Dior,Dior Homme Parfum,$168.00 - $227.00,4.4,778.0
Fragrance,Burberry,Her Eau de Parfum Duo Gift Set,$116.00,4.6,4000.0
Fragrance,Marc Jacobs,Perfect Eau de Toilette,$37.00 - $142.00,4.4,766.0
Fragrance,Coach,Wild Rose Eau de Parfum,$35.00 - $129.00,4.6,444.0
Fragrance,Hugo Boss,BOSS Bottled Beyond Eau de Parfum,$36.00 - $155.00,4.7,931.0
Fragrance,Kate Spade New York,Kate Spade New York Eau de Parfum,$29.00 - $104.00,4.6,604.0
Fragrance,Clinique,Happy Together Perfume Holiday Gift Set,$63.75,4.1,18.0
Fragrance,Tiffany & Co.,Tiffany & Love Eau de Parfum For Her,$150.00 - $181.00,4.4,640.0
Fragrance,Philosophy,Amazing Grace Eau de Parfum,$77.00,4.6,18798.0
Fragrance,Tiffany & Co.,Rose Gold Eau de Parfum,$111.00 - $178.00,4.4,1284.0
Fragrance,Snif,Vanilla Vice Eau de Toilette,$26.00 - $68.00,4.8,1905.0
Fragrance,ARMANI,My Way Sunny Vanilla Eau de Parfum,$99.00 - $170.00,4.6,379.0
Fragrance,Snif,Swede Tooth Eau de Toilette,$68.00,4.9,837.0
Fragrance,ARMANI,My Way Eau de Parfum Ylang,$37.00 - $170.00,4.7,1110.0
Fragrance,Snif,Lucky Streak Body Mist,$24.00 - $38.00,4.6,132.0
