category,brand,name,price,avg_rating,num_ratings
Fragrance,TOM FORD,Oud Minerale Eau de Parfum,$165.00 - $240.00,4.1,2660.0
Fragrance,Dior,Sauvage Spray For The Wild Travel Fragrance Eau de Toilette with Case,$113.00,4.5,2.0
Fragrance,Billie Eilish,Eilish Fragrance Mist,$18.00,3.8,83.0
Fragrance,Givenchy,Very Irresistible Eau de Parfum,$167.00,4.8,32.0
Fragrance,MUGLER,Angel Stellar Eau de Parfum,$37.00 - $190.00,4.4,1058.0
Fragrance,Touchland,Rich Pistachio Body & Hair Fragrance Mist,$20.00,4.4,334.0
Fragrance,Supersuite,Must Have Mist Me Boosting Body Mist,$20.00,4.0,11.0
Fragrance,Tree Hut,Ocean Glow Hydrating Fragrance Mist,$10.49,4.5,21.0
Fragrance,CHANEL,COCO Eau de Parfum Spray,$115.00,4.6,41.0
Fragrance,LE MONDE GOURMAND,Papaye Tropique Fresh Body Mist,$18.00,4.3,41.0
Fragrance,Marc Jacobs,Perfect Intense Eau de Parfum,$101.00 - $173.00,4.5,1400.0
Fragrance,CHANEL,N°5 L'EAU Eau de Toilette Spray,$185.00,4.1,22.0
Fragrance,Tory Burch,Sublime Eau de Toilette,$35.00 - $138.00,4.7,75.0
Fragrance,LE MONDE GOURMAND,Le Beach Fresh Body Mist,$18.00,4.4,7.0
Fragrance,Orebella,Parfum Discovery Set,$29.00,4.5,141.0
Fragrance,Chloé,Le Parfum,$40.00 - $190.00,4.5,483.0
Fragrance,Gucci,Bamboo Eau de Parfum,$126.00 - $138.00,4.7,1340.0
Fragrance,Aramis,Intuition by Aramis Intense Cologne,$32.00 - $140.00,5.0,1.0
Fragrance,CHANEL,COCO Eau de Toilette Spray,$124.00 - $155.00,4.6,14.0
Fragrance,Prada,Infusion d'Iris Eau de Parfum,$37.00 - $190.00,4.6,668.0
Fragrance,Vacation,"""AFTER SUN"" by Vacation Eau de Toilette",$60.00,4.6,713.0
Fragrance,ARMANI,Sì Eau de Parfum,$37.00 - $174.00,4.6,651.0
Fragrance,ULTA Beauty Collection,Peach Tea 3-Wick Scented Candle,$10.00,3.0,2.0
Fragrance,Nemat,Egyptian Musk Fragrance Oil,$20.99,4.4,18.0
Fragrance,Philosophy,Fresh Cream Soft Velvet Eau de Toilette Gift Set,$58.00,4.6,568.0
Fragrance,Orebella,Florals Travel Duo Gift Set,$49.00,4.8,28.0
Fragrance,Lancôme,La Vie Est Belle Vanille Nude Mother's Day Set with Perfume & Body Lotion,$179.00,,
Fragrance,Orebella,GOLDEN BRULEE Body & Hair Perfume Mist,$39.00,,
Fragrance,Ralph Lauren,Romance Hair & Body Mist,$40.00,4.6,76.0
Fragrance,CHANEL,PLATINUM ÉGOÏSTE Eau de Toilette Spray,$142.00,4.6,8.0
Fragrance,Dior,Miss Dior Eau de Parfum and Body Milk Set,$162.00,,
Fragrance,Givenchy,Gentleman Society Sport Eau de Parfum,$155.00,4.6,300.0
Fragrance,ULTA Beauty Collection,Rose Berry 3-Wick Scented Candle,$10.00,1.0,1.0
Fragrance,Beekman 1802,Milk Shake Moisture Mist for Body,$49.00,4.7,1479.0
Fragrance,DKNY,Be Delicious Orchard St.,$34.80 - $60.00,4.5,327.0
Fragrance,Burberry,Hero Eau de Parfum Cologne 2-Piece Gift Set,$170.00,4.5,2161.0
Fragrance,NEST New York,Perfume Oil Rollerball Discovery Set,$48.00,,
Fragrance,OCTAVIA MORGAN LOS ANGELES,MIDNIGHT ORCHARD Eau de Parfum,$45.00 - $150.00,4.6,216.0
Fragrance,florence by mills,Wildly Me Eau de Toilette,$24.00 - $55.00,4.7,189.0
Fragrance,NOYZ,Lost + Found Eau De Parfum,$38.00 - $85.00,4.5,337.0
Fragrance,Aramis,Intuition by Aramis Travel Spray Duo,$45.00,,
Fragrance,Dolce&Gabbana,Devotion Eau de Parfum Heart,$59.00,4.4,10.0
Fragrance,Odele,Hair + Body Mist - Grapefruit Orange Peel,$16.99,4.4,146.0
Fragrance,Snif,Bestseller Mini Bundle Eau de Toilette,$55.30,4.9,303.0
Fragrance,Ariana Grande,Wicked Elphaba Enchanted Eau de Parfum,$72.00,4.5,78.0
Fragrance,Valentino,Donna Born in Roma Eau de Parfum Mother's Day Gift Set,$195.00,,
Fragrance,Dolce&Gabbana,Light Blue EDT Gift Set,$99.00,,
Fragrance,Billie Eilish,Your Turn 2-Piece Set,$95.00,5.0,5.0
Fragrance,CHANEL,N°5 EAU PREMIÈRE Eau de Parfum Spray,$185.00,4.1,22.0
Fragrance,LE MONDE GOURMAND,Alice In Wonderland Le Petit Duo Set - Tea Party,$34.00,3.8,5.0
Fragrance,Kopari Beauty,Malibu Peach Hair & Body Mist,$29.00,4.7,75.0
Fragrance,Clinique,Clinique My Happy Lily of the Beach Perfume Spray,$26.25,4.6,42.0
Fragrance,Uni,Rain Water-Based Perfume,$28.00 - $72.00,4.3,14.0
Fragrance,Juicy Couture,Viva La Juicy Elixir Eau de Parfum,$36.00 - $140.00,4.3,4.0
Fragrance,BETTER WORLD FRAGRANCE HOUSE,Carby Musk Scented Candle,$84.00,4.5,31.0
Fragrance,Jimmy Choo,Jimmy Choo I Want Choo 2-Piece Gift Set,$160.00,3.7,3.0
Fragrance,Yves Saint Laurent,Libre Hair Mist,$65.00,4.1,15.0
Fragrance,MAËLYS,TEMPT Eau De Parfum,$79.00,4.8,465.0
Fragrance,Coach,Coach Love 4-Piece Set,$134.00,4.2,5.0
Fragrance,Nemat,White Musk Fragrance Oil,$20.99,2.9,30.0
Fragrance,TOM FORD,Black Orchid Reserve Parfum,$205.00 - $300.00,4.6,784.0
Fragrance,NEST New York,Madagascar Vanilla Perfume Oil Set,$104.00,5.0,2.0
Fragrance,Ellis Brooklyn,MISS STRAWBERRY Perfume Mist,$26.00,4.5,37.0
Fragrance,NEST New York,Mini Rollerball Trio,$28.00,4.3,3.0
Fragrance,NEST New York,Balinese Coconut Body Mist,$39.00,4.6,92.0
Fragrance,NEST New York,Creme de Clementine Eau de Parfum Duo,$98.00,5.0,1.0
Fragrance,Dior,J'adore Eau Lumière Eau de Toilette Roller-Pearl,$60.00,4.1,43.0
Fragrance,Rare Beauty,Find Comfort Body & Hair Fragrance Mist,$28.00,4.8,800.0
Fragrance,Ariana Grande,MOD Vanilla Mini 2-Piece Set,$30.00,4.2,18.0
Fragrance,Givenchy,Irresistible Eau de Parfum 2-Piece Gift Set,$116.00,3.0,1.0
Fragrance,Orebella,GARDENIA'S WHISPER Body & Hair Perfume Mist,$39.00,5.0,2.0
Fragrance,NOYZ,Be Her By Ella Langley,$85.00,,
Fragrance,Philosophy,Fresh Cream Warm Cashmere Body Lotion,$32.00,4.6,4123.0
Fragrance,Viktor&Rolf,Spicebomb Dark Leather Eau de Parfum,$155.00,4.6,824.0
Fragrance,Orebella,NECTAR DEW Body & Hair Perfume Mist,$39.00,,
Fragrance,Versace,Dylan Turquoise Eau de Toilette Gift Set,$72.00,4.0,23.0
Fragrance,Tiffany & Co.,Tiffany & Love Eau de Toilette For Him,$112.00 - $137.00,4.6,186.0
Fragrance,Carolina Herrera,Bad Boy Cobalt Limited Edition Men's Gift Set,$132.00,4.6,434.0
Fragrance,Elizabeth Arden,Eternal Aura Eau de Parfum,$69.00 - $115.00,4.4,647.0
Fragrance,Billie Eilish,Eilish & Your Turn Duo Set,$100.00,5.0,1.0
Fragrance,Dior,Miss Dior Mini Miss Blooming Bouquet Solid Perfume,$75.00,4.6,451.0
Fragrance,Prada,Paradoxe Hair Mist,$75.00,3.7,3.0
Fragrance,NEST New York,Indian Jasmine Body Mist,$39.00,4.6,83.0
Fragrance,Burberry,Burberry Goddess Eau de Parfum and Body Lotion 3-Piece Gift Set,$191.00,4.7,2350.0
Fragrance,CHANEL,ALLURE HOMME Eau de Toilette Spray,$142.00,4.7,7.0
Fragrance,IGK,Velvet Muse Hair & Body Fragrance Mist,$32.00,4.4,214.0
Fragrance,NOYZ,The Solid Fragrance - Sh**ty Day,$42.00,4.8,79.0
Fragrance,LE MONDE GOURMAND,Alice In Wonderland Le Petit Duo Set - Characters,$34.00,4.5,2.0
Fragrance,Dior,Miss Dior Mini Miss Parfum Solid Perfume,$99.00,4.6,440.0
Fragrance,Rabanne,Phantom Eau de Toilette,$96.00 - $153.00,4.5,516.0
Fragrance,NEST New York,Madagascar Vanilla Body Mist,$39.00,4.6,108.0
Fragrance,Ellis Brooklyn,FIRST DATE Perfume Mist,$26.00,4.5,42.0
Fragrance,Clinique,My Happy Cookies & Kisses Perfume Spray,$26.25,4.0,201.0
Fragrance,CHANEL,GABRIELLE CHANEL L'EAU Eau de Toilette Spray,$154.00 - $185.00,4.1,9.0
Fragrance,ULTA Beauty Collection,Floral Fields 3-Wick Scented Candle,$10.00,3.5,4.0
Fragrance,ARMANI,Acqua di Gioia Eau de Parfum Valentine's Day Gift Set,$150.00,,
Fragrance,Gucci,Guilty Pour Homme Eau de Parfum and Shower Gel 3-Piece Gift Set,$175.00,,
Fragrance,CHANEL,COCO MADEMOISELLE Moisturizing Body Lotion,$78.00,4.7,35.0
Fragrance,Philosophy,Amazing Grace Ballet Rose Eau de Parfum,$77.00,4.6,387.0
Fragrance,Rabanne,Million Gold for Her Parfum,$39.00 - $202.00,4.6,111.0
Fragrance,L'Occitane,Almond Hair & Body Mist,$40.00,5.0,8.0
Fragrance,Burberry,Her London Dream Eau de Parfum,$181.00,4.4,662.0
Fragrance,Orebella,Woods Travel Duo Gift Set,$49.00,4.4,27.0
Fragrance,Miu Miu,Miutine Eau de Parfum Travel Duo Holiday Gift Set,$144.00,5.0,3.0
Fragrance,Kopari Beauty,Marbella Bloom Hair & Body Mist,$20.30,4.2,43.0
Fragrance,The Nue Co. ,First Milk Comfort Gourmand Eau de Parfum,$38.00 - $125.00,4.7,19.0
Fragrance,Juicy Couture,Viva La Juicy Sucré Eau De Parfum,$33.00 - $105.00,4.6,2259.0
Fragrance,OCTAVIA MORGAN LOS ANGELES,DARK ROSE Eau de Parfum,$45.00 - $150.00,4.7,242.0
Fragrance,TOCCA,Florence Eau de Parfum,$32.00 - $92.00,4.9,28.0
Fragrance,LE MONDE GOURMAND,Fruit du Dragon Fresh Body Mist,$18.00,4.1,7.0
Fragrance,Billie Eilish,Eilish 3 Piece Gift Set,$95.00,5.0,11.0
Fragrance,Carolina Herrera,Mini Bad Boy Cobalt Cologne Duo Set,$35.00,,
Fragrance,Sabrina Carpenter,Cherry Baby Eau de Parfum,$35.00 - $55.00,4.6,597.0
Fragrance,Marc Jacobs,Daisy Dream Eau de Toilette,$142.00,4.6,1244.0
Fragrance,Supersuite,Caramel Temptress Eau De Parfum Intense,$49.00,4.2,40.0
Fragrance,Coach,Floral Eau de Parfum 4-Piece Set,$134.00,,
Fragrance,Estée Lauder,Bronze Goddess Nuit Eau de Parfum,$32.00 - $118.00,4.6,42.0
Fragrance,CHANEL,BLEU DE CHANEL Eau de Parfum Twist and Spray,$146.00,4.5,6.0
Fragrance,Montblanc,Explorer Eau de Parfum 3 Piece Set,$136.00,,
Fragrance,Carolina Herrera,Very Good Girl Elixir Perfume Oil Drops,$70.00,4.0,6.0
Fragrance,Lake & Skye,222 Cosmic Coco + Musk Hair & Body Mist,$32.00,4.5,124.0
Fragrance,Carolina Herrera,Good Girl Eau de Parfum 3-Piece Limited Edition Gift Set,$174.00,,
Fragrance,DIME,Dans Les Bois Eau de Parfum,$25.00 - $62.00,4.4,5091.0
Fragrance,NEST New York,Lychee Rose Body Mist,$39.00,4.4,116.0
Fragrance,Dolce&Gabbana,My Devotion Eau De Parfum Intense Heart,$60.00,,
Fragrance,Snif,Berry Styles Body Mist,$24.00 - $38.00,4.8,282.0
Fragrance,Tiffany & Co.,Tiffany Sheer Eau de Toilette,$99.00 - $151.00,4.5,373.0
Fragrance,Supersuite,Pear Skin Eau De Parfum Intense,$49.00,4.6,38.0
Fragrance,Truly,Unicorn Fruit Eau de Parfum,$59.00,4.6,572.0
Fragrance,Dolce&Gabbana,Light Blue Pour Homme Eau de Toilette Gift Set,$116.00,,
Fragrance,TOM FORD,Signature Mini Duo Discovery Gift Set,$35.00,2.7,11.0
Fragrance,Lake & Skye,11 11 Collection Travel Spray Trio Set,$60.00,4.5,10.0
Fragrance,Jean Paul Gaultier,Mini Gaultier Cologne Replica Sampler Set,$58.00,,
Fragrance,ARMANI,Acqua Di Gio Eau de Parfum Intense,$90.00 - $160.00,4.7,1109.0
Fragrance,Lake & Skye,555 Strawberry + Aire Hair & Body Mist,$32.00,4.5,124.0
Fragrance,Supersuite,Gimmie Flowers Eau De Parfum Intense,$49.00,4.7,17.0
Fragrance,Lake & Skye,Hair & Body Mist Discovery Set,$35.00,4.7,19.0
Fragrance,ARMANI,Giorgio Armani Acqua Di Gioia Eau de Parfum Mother's Day Gift Set,$85.00,,
Fragrance,Chloé,Nomade Eau de Parfum,$111.00 - $178.00,4.6,480.0
Fragrance,Hempz,Sweet Pineapple & Honey Melon Body Moisturizer Spray,$5.99,5.0,2.0
Fragrance,NEST New York,Mini Fragrance Discovery Set,$46.00,4.8,18.0
Fragrance,ULTA Beauty Collection,Lemon Tart 3-Wick Scented Candle,$10.00,2.7,3.0
Fragrance,OCTAVIA MORGAN LOS ANGELES,4 Piece Discovery Set,$28.00,4.6,9.0
Fragrance,Dior,Miss Dior Blooming Bouquet Hair Mist,$82.00,5.0,1.0
Fragrance,Coach,Floral Eau de Parfum 2-Piece Set,$102.00,4.5,4.0
Fragrance,Clinique,Happy in Paradise Eau de Parfum Rollerball,$24.00,4.0,37.0
Fragrance,Carolina Herrera,Good Girl Hair Mist,$45.00,4.6,66.0
Fragrance,Hawthorne,Canary Diamond Eau de Parfum,$60.00,4.4,5.0
Fragrance,Hawthorne,Double Dare Eau de Parfum,$60.00,4.3,6.0
Fragrance,Marc Jacobs,Daisy Eau So Intense Eau de Parfum,$96.00 - $130.00,4.5,1411.0
Fragrance,NOYZ,"Listen, Honey Hair + Body Fragrance Mist",$42.00,4.8,68.0
Fragrance,Dior,Miss Dior Mini Miss Eau de Parfum Solid Perfume,$89.00,4.5,455.0
Fragrance,Versace,Bright Crystal Parfum,$168.00,5.0,5.0
Fragrance,Snif,Tart Deco Eau de Toilette,$68.00,4.8,982.0
Fragrance,OCTAVIA MORGAN LOS ANGELES,LEGENDARY Eau de Parfum,$45.00 - $150.00,4.6,125.0
Fragrance,Rizos Curls,California Classic Hair & Body Perfume,$40.00,4.6,30.0
Fragrance,Hawthorne,Desert Runway Eau de Parfum,$60.00,4.5,4.0
Fragrance,Prada,Infusion de Santal Chai Eau de Parfum,$35.00 - $190.00,4.6,781.0
Fragrance,Ariana Grande,God Is A Woman Eau de Parfum,$28.00,4.1,1537.0
Fragrance,Blind Barber,Speakeasy,$98.00,4.0,25.0
Fragrance,ARMANI,Sì Passione Eau de Parfum,$37.00 - $140.00,4.7,5558.0
Fragrance,Dolce&Gabbana,The One For Men Parfum,$190.00,4.6,93.0
Fragrance,NOYZ,The Solid Fragrance - 12:00,$42.00,4.8,106.0
Fragrance,Versace,Versace Crystal Noir Eau De Parfum,$148.00,4.6,34.0
Fragrance,Jean Paul Gaultier,La Belle Flower Limited-Edition Eau de Parfum,$155.00,4.3,20.0
Fragrance,Pacifica,Hair Perfume,$14.00,4.9,83.0
Fragrance,Donna Karan,Cashmere Mist Eau de Toilette,$72.00 - $115.00,4.8,310.0
Fragrance,ONYX Professional ,Mistify Me Luminous Body and Hair Mist,$12.99,4.3,152.0
Fragrance,Ralph Lauren,Romance Elixir,$35.00 - $136.00,4.3,1967.0
Fragrance,Lancôme,La Vie Est Belle Iris Absolu Eau De Parfum,$137.00 - $170.00,4.6,2834.0
Fragrance,OCTAVIA MORGAN LOS ANGELES,L'AFFAIRE Eau de Parfum,$45.00 - $150.00,4.8,133.0
Fragrance,Clinique,My Happy Baby Bouquet Perfume Spray,$26.25,4.1,51.0
Fragrance,Beyoncé Parfums,CÉ LUMIÈRE Eau de Parfum,$160.00,4.2,45.0
Fragrance,Gucci,Guilty Pour Homme Essence Eau de Toilette and Shower Gel 3-Piece Gift Set,$147.00,4.5,491.0
Fragrance,KYLIE COSMETICS,Hair and Body Mist,$28.00,4.5,931.0
Fragrance,BETTER WORLD FRAGRANCE HOUSE,Sweeter Tings Scented Candle,$54.00,4.8,30.0
Fragrance,Snif,Berry Croissant Layering Bundle,$30.80,4.9,200.0
Fragrance,Versace,Eros Najim Parfum,$135.00 - $170.00,5.0,1.0
Fragrance,NEST New York,Lychee Rose Eau de Parfum Travel Spray,$32.00,4.9,212.0
Fragrance,Lake & Skye,444 Sunkissed + Monoi Hair & Body Mist,$32.00,4.5,124.0
Fragrance,Tiffany & Co.,Tiffany Eau de Parfum 3-Piece Gift Set,$178.00,4.0,3.0
Fragrance,Estée Lauder,Beautiful Belle Eau de Parfum,$112.00,4.7,8925.0
Fragrance,Ariana Grande,Ariana Grande 4-Piece Coffret,$50.00,3.9,14.0
Fragrance,Dior,J'adore Eau de Parfum and Body Milk Gift Set,$161.00,,
Fragrance,CHANEL,COCO MADEMOISELLE Body Oil,$139.00,5.0,1.0
Fragrance,Coach,Coach For Men Eau de Toilette 2-Piece Set,$126.00,5.0,1.0
Fragrance,NOYZ,The Solid Fragrance - Love Club,$42.00,4.7,83.0
Fragrance,NOYZ,JUICY CHAOS Hair + Body Fragrance Mist,$42.00,4.6,68.0
Fragrance,Rabanne,1 Million Royal Parfum,$114.00,4.6,496.0
Fragrance,Lancôme,Idôle L'Eau de Toilette,$64.00 - $145.00,4.6,559.0
Fragrance,Ralph Lauren,Polo Blue Eau de Parfum,$130.00,4.7,1709.0
Fragrance,Marc Jacobs,Daisy Wild Eau de Parfum & Body Lotion 3-Piece Gift Set,$170.00,4.5,1072.0
Fragrance,The Nue Co. ,Functional Fragrance Discovery Set,$45.00,4.3,3.0
Fragrance,Marc Jacobs,Daisy Eau So Fresh Eau de Toilette and Body Lotion 3-Piece Gift Set,$165.00,4.7,11215.0
Fragrance,Truly,Vanilla Baby Eau de Parfum,$59.00,4.4,57.0
Fragrance,Pacifica,Silver Moon Spray Perfume,$13.49,4.5,191.0
Fragrance,Snif,Hazel Split Body Mist,$24.00 - $38.00,4.8,177.0
Fragrance,Kate Spade New York,Kate Spade New York Pop Set,$110.00,,
Fragrance,BETTER WORLD FRAGRANCE HOUSE,Carby Musk Fragrance Oil Rollerball,$195.00,4.6,42.0
Fragrance,Nemat,Musk Amber Fragrance Oil,$20.99,4.5,13.0
Fragrance,Paris Hilton Fragrances,ICONIC 2-Piece Gift Set,$85.00,4.3,4.0
Fragrance,Viktor&Rolf,Flowerbomb Tiger Lily Eau de Parfum 3-Piece Gift Set,$155.00,,
Fragrance,The Nue Co. ,Forest Lungs De-Stress Eau de Parfum,$38.00 - $125.00,4.8,568.0
Fragrance,Rabanne,Fame Eau de Parfum Intense,$99.00 - $175.00,4.5,257.0
Fragrance,Givenchy,L'Interdit Eau de Parfum,$115.00 - $175.00,4.4,903.0
Fragrance,Kate Spade New York,Kate Spade Cherie Je T'Aime 3-Piece Set,$99.00,3.0,1.0
Fragrance,Moschino,Toy Boy Eau de Parfum,$76.00 - $96.00,4.3,351.0
Fragrance,Clinique,Aromatics Elixir Body Smoother Lotion,$39.75,4.8,87.0
Fragrance,Kopari Beauty,Seychelles Sands Hair & Body Mist,$29.00,4.4,99.0
Fragrance,Truly,Soft Serve Perfume Mist,$28.00,4.4,83.0
Fragrance,Pacifica,Island Vanilla Spray Perfume,$13.49,4.0,463.0
Fragrance,Lake & Skye,333 Sheer Fig + Salt Hair & Body Mist,$32.00,4.5,124.0
Fragrance,Lake & Skye,Limited Edition 11 11 Eau de Parfum Duo Gift Set,$98.00,4.3,35.0
Fragrance,Yves Saint Laurent,Mon Paris Eau de Parfum 2-Piece Travel Gift Set,$103.00,,
Fragrance,Hempz,Original Body Moisturizer Spray,$5.99,4.0,1.0
Fragrance,Pacifica,Indian Coconut Nectar Spray Perfume,$13.49,4.5,269.0
Fragrance,Clean,Classic Skin Eau de Parfum,$48.00 - $78.00,4.5,206.0
Fragrance,NEST New York,Himalayan Salt & Rosewater Reed Diffuser,$65.00,4.3,8.0
Fragrance,Prada,Luna Rossa Eau de Toilette,$136.00,4.5,634.0
Fragrance,Truly,The Perfumer's Set - Discovery Trio,$59.00,4.6,22.0
Fragrance,BEVEL,Post-Shave Balm with Tea Tree Oil,$12.95,3.5,2.0
Fragrance,Jimmy Choo,Man Parfum,$116.00 - $150.00,,
Fragrance,Rabanne,Mini Million Gold for Her Duo Gift Set,$39.00,,
Fragrance,Prada,Prada 2-Piece Paradoxe Eau de Parfum Gift Set,$115.00,,
Fragrance,Lancôme,La Vie Est Belle Soleil Cristal Eau de Parfum,$125.00,4.6,768.0
Fragrance,Rabanne,Invictus Elixir Parfum Elixir,$176.00,,
Fragrance,Beyoncé Parfums,Two Tone Duo Set,$44.00,4.3,12.0
Fragrance,Pacifica,Take Me There Mini Perfume Set,$9.99,3.4,27.0
Fragrance,Givenchy,Irresistible 3 Piece Travel Spray Discovery Set,$74.00,4.9,11.0
Fragrance,Ellis Brooklyn,SUPER AMBER Eau de Parfum,$33.00 - $115.00,4.3,100.0
Fragrance,The Nue Co. ,Water Therapy Calm Eau de Parfum,$38.00 - $125.00,4.8,59.0
Fragrance,ULTA Beauty Collection,Vanilla Velour Soy Blend Candle,$10.00,3.3,8.0
Fragrance,Burberry,Hero Eau de Parfum & Parfum Travel Spray 3-Piece Gift Set,$75.00,3.0,1.0
Fragrance,Ralph Lauren,Ralph's Club New York Eau de Parfum 2 Piece Gift Set,$160.00,,
Fragrance,NEST New York,Himalayan Salt & Rosewater Classic Candle,$50.00,5.0,3.0
Fragrance,Versace,Crystal Noir Parfum,$168.00,4.1,7.0
Fragrance,ULTA Beauty Collection,Vanilla Velour Scented Hair & Body Mist,$6.00 - $15.00,,
Fragrance,Prada,Les Infusions Discovery Set,$30.00,4.7,3.0
Fragrance,Burberry,Burberry Goddess Eau De Parfum and Parfum Travel Spray 3-Piece Gift Set,$80.00,,
Fragrance,Truly,Birthday Sex Perfume Mist,$28.00,4.4,123.0
Fragrance,NOYZ,Mini Hair + Body Fragrance Mist Trio,$48.00,4.5,59.0
Fragrance,Pacifica,Dream Moon Spray Perfume,$13.49,4.1,563.0
Fragrance,Sabrina Carpenter,Caramel Dream Eau de Parfum,$35.00 - $55.00,4.6,320.0
Fragrance,Viktor&Rolf,Flowerbomb Pretty Peony Mother's Day Gift Set,$155.00,,
Fragrance,Clean,Classic Warm Cotton Eau de Parfum,$24.00 - $78.00,3.7,62.0
Fragrance,Prada,Paradoxe Intense Eau de Parfum 2-Piece Gift Set,$120.00,,
Fragrance,ARMANI,My Way Eau de Parfum Valentine's Day Gift Set,$180.00,,
Fragrance,Snif,Gentle Reminder Eau de Toilette,$68.00,4.9,1142.0
Fragrance,Ralph Lauren,Ralph Lauren Romance Discovery Gift Set Duo,$35.00,3.7,3.0
Fragrance,Moschino,Toy 2 Eau de Parfum,$56.00 - $96.00,4.3,413.0
Fragrance,NEST New York,Sunlit Yuzu & Neroli Reed Diffuser,$65.00,5.0,1.0
Fragrance,Tory Burch,Sublime Eau de Parfum Travel Spray Set,$45.00,4.4,5.0
Fragrance,CHANEL,N°1 DE CHANEL L'Eau Rouge,$135.00,3.8,54.0
Fragrance,Coach,Pure Platinum Parfum,$100.00 - $135.00,4.7,397.0
Fragrance,Hawthorne,Dark Suede Eau de Parfum,$60.00,5.0,4.0
Fragrance,Hempz,Serene Waters Body Moisturizer Spray with Magnesium,$14.99,4.6,127.0
Fragrance,TOM FORD,Black Orchid Discovery Set,$45.00,5.0,1.0
Fragrance,BETTER WORLD FRAGRANCE HOUSE,3 piece Scented Candle Votive Set,$55.00,4.6,32.0
Fragrance,CHANEL,BLEU DE CHANEL All-Over Spray,$100.00 - $115.00,3.0,1.0
Fragrance,Hempz,Sweet Jasmine & Rose Body Moisturizer Spray with Collagen Booster,$14.99,4.7,127.0
Fragrance,CHANEL,COCO MADEMOISELLE Eau de Parfum Twist and Spray Set,$220.00,5.0,1.0
Fragrance,Givenchy,Ange ou Démon le Secret Eau de Parfum,$143.00 - $183.00,4.6,108.0
Fragrance,NEST New York,Golden Nectar Eau de Parfum,$32.00 - $92.00,4.7,254.0
Fragrance,ULTA Beauty Collection,Scented Gel Hand Soap,$4.00,4.0,1.0
Fragrance,ULTA Beauty Collection,Midnight Noir Soy Blend Candle,$10.00,4.3,4.0
Fragrance,Jean Paul Gaultier,La Belle Rosea Eau de Parfum,$96.00 - $166.00,4.5,65.0
Fragrance,DKNY,DKNY 24/7,$34.80 - $60.00,4.3,272.0
Fragrance,LE MONDE GOURMAND,000 Perfume Oil,$30.00,4.8,15.0
Fragrance,Origins,Ginger Essence Sensuous Skin Perfume Scent,$77.00,4.0,13.0
Fragrance,Burberry,Her Blossom Eau de Toilette,$155.00,4.3,392.0
Fragrance,Sabrina Carpenter,Sweet Tooth Body Spray,$12.00,,
Fragrance,CHANEL,BLEU DE CHANEL Parfum Twist and Spray,$179.00,,
Fragrance,Givenchy,Amarige Eau de Toilette,$159.00,4.6,136.0
Fragrance,Hempz,Dark Red Cherries Body Moisturizer Spray,$2.99,3.0,1.0
Fragrance,Guerlain,Mon Guerlain Eau de Parfum,$180.00,4.8,142.0
Fragrance,Valentino,Uomo Born in Roma Eau de Toilette Gift Set,$185.00,5.0,1.0
Fragrance,DKNY,Be Delicious Eau de Parfum + Mini Deodorant Set,$25.00,,
Fragrance,CHANEL,BLEU DE CHANEL After Shave Lotion,$80.00,4.2,5.0
Fragrance,Prada,Infusions de Rhubarbe Eau de Parfum,$37.00 - $190.00,3.7,3.0
Fragrance,Azzaro,Wanted Eau de Toilette,$120.00,4.3,797.0
Fragrance,ULTA Beauty Collection,Wool & Tonka Soy Blend Candle,$10.00,4.1,11.0
Fragrance,Estée Lauder,Bronze Goddess Eau Fraîche Eau de Parfum Travel Spray,$32.00,3.9,163.0
Fragrance,Rabanne,Phantom Elixir,$183.00,4.5,272.0
Fragrance,The Nue Co. ,Otherwhere Comfort Gourmand Eau de Parfum,$38.00 - $125.00,4.9,14.0
Fragrance,Philosophy,Amazing Grace Eau de Parfum Intense,$82.00,4.3,895.0
Fragrance,Ariana Grande,Moonlight Eau de Parfum,$50.00 - $72.00,4.6,358.0
Fragrance,Jimmy Choo,Fever 3 Piece Gift Set,$142.00,,
Fragrance,NEST New York,Driftwood & Chamomile Reed Diffuser,$65.00,3.7,3.0
Fragrance,Rabanne,Lady Million Eau de Parfum,$98.00 - $135.00,4.3,6.0
Fragrance,Coach,Coach Women's Mini Duo Set,$32.00,2.3,3.0
Fragrance,BETTER WORLD FRAGRANCE HOUSE,Williamsburg Sleepover Scented Candle,$54.00,4.4,8.0
Fragrance,Lake & Skye,11 11 Azure Fragrance Oil Rollerball,$48.00,4.8,49.0
Fragrance,Hempz,Ocean Breeze Body Moisturizer Spray with Hyaluronic Acid,$14.99,4.6,121.0
Fragrance,Jean Paul Gaultier,Le Male Elixir Absolu Parfum Intense,$150.00 - $189.00,4.6,275.0
Fragrance,Givenchy,L'Interdit Rouge Eau de Parfum,$55.00 - $175.00,4.1,823.0
Fragrance,Hempz,Glow Getter Shimmer Body Mist,$7.49,4.6,106.0
Fragrance,Dolce&Gabbana,Dolce Rose Eau de Toilette,$108.00,4.4,43.0
Fragrance,Viktor&Rolf,Flowerbomb Eau de Parfum Mother's Day Gift Set,$110.00,,
Fragrance,CHANEL,BLEU DE CHANEL 3-in-1 Moisturizer,$80.00,4.0,4.0
Fragrance,Sabrina Carpenter,Bite Sized Sweet Tooth Eau de Parfum,$20.00,4.9,1259.0
Fragrance,Prada,Infusion de Gingembre Eau De Parfum,$37.00 - $190.00,4.3,273.0
Fragrance,Lake & Skye,11 11 Body Oil,$48.00,4.5,211.0
Fragrance,Lake & Skye,11 11 Lychee Eau de Parfum,$36.00 - $105.00,4.0,36.0
Fragrance,florence by mills,Soft Girl Hair & Body Mist,$18.00,5.0,2.0
Fragrance,Sabrina Carpenter,Me Espresso Eau de Parfum,$35.00 - $55.00,4.2,680.0
Fragrance,Lake & Skye,11 11 Vanilla Fragrance Oil Rollerball,$48.00,4.8,38.0
Fragrance,Verb,Amber + Jasmine Hair and Body Fragrance Mist,$22.00,4.6,145.0
Fragrance,Ralph Lauren,Ralph's Club Eau de Toilette,$116.00,4.7,1884.0
Fragrance,Lancôme,Lancôme Vault Idôle Now Summer Set 2025,$199.00,,
Fragrance,NEST New York,Wild Mint & Eucalyptus Reed Diffuser,$65.00,3.4,8.0
Fragrance,Calvin Klein,Obsession For Men Eau de Toilette,$103.00 - $130.00,4.5,224.0
Fragrance,Jimmy Choo,Blossom Eau de Parfum,$64.00,4.4,44.0
Fragrance,Ariana Grande,WICKED For Good Spray Pen Duo Set by Ariana Grande Fragrances,$42.00,4.1,17.0
Fragrance,TOCCA,Cleopatra Eau de Parfum,$92.00,4.8,10.0
Fragrance,MUGLER,Alien Discovery Gift Set,$45.00,5.0,1.0
Fragrance,Ellis Brooklyn,DESSERT DUO: Mini APPLE LOVE & VANILLA MILK Duo Set,$37.00,3.5,6.0
Fragrance,Versace,Bright Crystal Duo Mini Set,$30.00,,
Fragrance,Orebella,'Ôrəbella Perfume Stand for 3.4 oz,$35.00,4.2,38.0
Fragrance,Calvin Klein,Eternity For Men Eau de Toilette,$113.00,4.7,833.0
Fragrance,ULTA Beauty Collection,Coconut Coast Scented Hair & Body Mist,$6.00 - $15.00,,
Fragrance,Snif,Dead Dinosaur Eau de Toilette,$68.00,4.9,397.0
Fragrance,Jimmy Choo,I Want Choo 2-Piece Set,$160.00,4.9,7.0
Fragrance,Ellis Brooklyn,FLORIST Eau de Parfum,$33.00 - $115.00,4.7,57.0
Fragrance,Pura,Pura Smart Vial Diffuser Refill,$13.99 - $15.99,4.7,615.0
Fragrance,Dolce&Gabbana,Q by Dolce&Gabbana Eau de Parfum Intense,$39.00 - $184.00,4.5,140.0
Fragrance,Truly,Glazed Donut Perfume Mist,$28.00,4.5,173.0
Fragrance,Versace,Eros Pour Femme Eau de Parfum,$105.00,4.1,38.0
Fragrance,Rabanne,Fame Eau de Parfum and Fame Parfum Mini Duo Gift Set,$35.00,4.5,508.0
Fragrance,Clean,Sugar-Coated Eau de Parfum,$48.00 - $78.00,4.7,175.0
Fragrance,Ellis Brooklyn,MARSHMALLOWS Perfume Mist,$26.00 - $39.00,4.6,18.0
Fragrance,Dior,J'adore Les Adorables Shimmering Body Oil,$94.00,5.0,3.0
Fragrance,Pacifica,Passion Fruit Spray Perfume,$13.49,4.0,42.0
Fragrance,Hugo Boss,HUGO Man Eau de Toilette,$81.00 - $102.00,4.5,588.0
Fragrance,Prada,Infusion de Rose Eau de Parfum,$37.00 - $190.00,2.5,4.0
Fragrance,Givenchy,Gentleman Society Extrême Eau de Parfum,$162.00,4.8,479.0
Fragrance,florence by mills,Coastal Chic Hair & Body Mist,$18.00,5.0,1.0
Fragrance,ULTA Beauty Collection,Daydream Skies Scented Hair & Body Mist,$6.00 - $15.00,,
Fragrance,Philosophy,Amazing Grace Lavender Eau de Toilette,$67.00,4.3,687.0
Fragrance,Ellis Brooklyn,MYTH Eau de Parfum,$33.00 - $115.00,4.5,157.0
Fragrance,Ariana Grande,LOVENOTES Vanilla Suede Eau de Parfum,$80.00,,
Fragrance,Dior,Sauvage After Shave Balm,$76.00,4.5,42.0
Fragrance,narka,Creamy Veil Hair Mist Blossom Dawn,$22.00,,
Fragrance,HomeWorx,Jasmine & White Peach Candle and Reed Stick Diffuser Gift Set,$19.60,,
Fragrance,Lake & Skye,11 11 Collection 5 Piece Set,$36.00,4.8,10.0
Fragrance,ULTA Beauty Collection,Cashmere Crush Scented Hair & Body Mist,$6.00 - $15.00,,
Fragrance,Estée Lauder,Spellbound Eau de Parfum Fragrance Spray,$80.00,4.5,25.0
Fragrance,Hugo Boss,BOSS Bottled Eau de Toilette,$127.00,4.7,139.0
Fragrance,NEST New York,Wild Mint & Eucalyptus Classic Candle,$50.00,5.0,7.0
Fragrance,NEST New York,Perfume Oil Vial Discovery Set,$26.00,4.3,135.0
Fragrance,Calvin Klein,Obsession Eau de Parfum,$64.00,4.5,424.0
Fragrance,Philosophy,Amazing Grace Whipped Body Creme,$47.00,4.7,343.0
Fragrance,Donna Karan,Cashmere Mist 3-Piece Eau de Parfum Set,$143.00,,
Fragrance,Ellis Brooklyn,SUN FRUIT Eau de Parfum,$33.00 - $115.00,4.5,92.0
Fragrance,Gucci,Guilty Elixir de Parfum Pour Femme,$187.00,4.4,1540.0
