category,brand,name,price,avg_rating,num_ratings
Fragrance,Viktor&Rolf,Flowerbomb Tiger Lily Eau de Parfum,$35.00 - $182.00,4.7,1481.0
Fragrance,Azzaro,Forever Wanted Elixir,$125.00 - $155.00,4.7,2992.0
Fragrance,ARMANI,My Way Nectar Eau de Parfum,$99.00 - $170.00,4.5,511.0
Fragrance,LE MONDE GOURMAND,Miel Bébé Eau De Parfum,$28.00,4.7,133.0
Fragrance,Snif,Crunch Time Body Mist,$24.00 - $38.00,4.8,134.0
Fragrance,Versace,Bright Crystal Eau de Toilette 2 Piece Gift Set,$79.00,4.6,41.0
Fragrance,Rabanne,Phantom Eau de Parfum Intense,$117.00 - $150.00,4.6,386.0
Fragrance,Yves Saint Laurent,Y Elixir,$198.00,4.7,1787.0
Fragrance,Philosophy,Amazing Grace Firming Body Emulsion,$49.00,4.6,18798.0
Fragrance,Philosophy,Hair & Body Perfume Mist,$28.00,4.5,812.0
Fragrance,Viktor&Rolf,Spicebomb Night Vision Eau de Parfum,$155.00,4.5,168.0
Fragrance,Rabanne,Million Gold Eau de Parfum Intense,$38.00 - $145.00,4.4,422.0
Fragrance,Coach,Dreams Eau de Parfum,$35.00 - $124.00,4.3,1410.0
Fragrance,Azzaro,Forever Wanted Absolu,$125.00 - $155.00,4.7,1242.0
Fragrance,Jean Paul Gaultier,Gaultier Divine Couture Eau de Parfum,$97.00 - $173.00,4.2,216.0
Fragrance,CHANEL,ALLURE HOMME SPORT Eau de Toilette Spray,$115.00 - $142.00,4.4,19.0
Fragrance,Burberry,Burberry Goddess Eau de Parfum Duo Gift Set,$116.00,4.7,2350.0
Fragrance,DIME,7 Summers Eau de Toilette,$62.00,4.7,5235.0
Fragrance,LE MONDE GOURMAND,Crème Vanille Eau De Parfum,$28.00,4.4,133.0
Fragrance,Versace,Eros Pour Femme Eau de Toilette,$92.00,4.6,181.0
Fragrance,Gucci,Bloom Ambrosia d'Oro Eau de Parfum,$40.00 - $168.00,4.4,458.0
Fragrance,Lancôme,La Vie Est Belle Mini Duo Perfume Gift Set,$29.00,5.0,2.0
Fragrance,Ariana Grande,LOVENOTES Pink Woods Eau de Parfum,$32.00 - $80.00,4.2,398.0
Fragrance,Kitsch,Hair Perfume Discovery 4 Piece Set,$15.00,4.4,686.0
Fragrance,Yves Saint Laurent,Black Opium Eau de Parfum Glitter,$37.00 - $172.00,4.5,2036.0
Fragrance,ARMANI,Emporio Armani Stronger With You Eau de Toilette,$95.00 - $120.00,4.7,2186.0
Fragrance,Clinique,My Happy Cocoa & Cashmere Perfume Spray,$26.25 - $81.00,4.2,573.0
Fragrance,Snif,Hot Cakes Eau de Toilette,$26.00 - $68.00,4.8,1375.0
Fragrance,Nemat,Bestsellers Perfume Oil Discovery Kit,$29.99,3.9,56.0
Fragrance,ARMANI,Code Eau de Parfum,$88.00 - $175.00,4.6,995.0
Fragrance,ARMANI,Emporio Armani Stronger With You Parfum,$120.00 - $145.00,4.7,1058.0
Fragrance,Rabanne,Invictus Victory Absolu Parfum Intense,$144.00 - $183.00,4.7,392.0
Fragrance,Burberry,Her Eau de Parfum 3-Piece Gift Set,$191.00,4.6,4000.0
Fragrance,Montblanc,Legend Eau de Toilette,$37.00 - $112.00,4.6,1660.0
Fragrance,CHANEL,COCO MADEMOISELLE L'EAU PRIVÉE Eau Pour la Nuit Spray,$124.00 - $155.00,4.1,28.0
Fragrance,Paris Hilton Fragrances,ICONIC Eau de Parfum,$27.00 - $80.00,4.5,258.0
Fragrance,TOM FORD,Ombre Leather Parfum,$67.00 - $300.00,4.3,737.0
Fragrance,Dolce&Gabbana,Light Blue Capri In Love Pour Homme Eau de Parfum,$130.00 - $160.00,4.4,88.0
Fragrance,Yves Saint Laurent,L'Homme Eau de Toilette,$130.00,4.8,710.0
Fragrance,Dior,Hypnotic Poison Eau de Toilette,$98.00 - $120.00,4.5,549.0
Fragrance,Prada,Luna Rossa Ocean Eau de Parfum,$35.00 - $155.00,4.7,3192.0
Fragrance,Gucci,Guilty Parfum Pour Homme,$163.00 - $238.00,4.5,2537.0
Fragrance,Estée Lauder,Beautiful Eau de Parfum Spray,$82.00 - $160.00,4.6,1073.0
Fragrance,Rabanne,Phantom Parfum,$132.00 - $172.00,4.5,360.0
Fragrance,Rabanne,Fame Eau de Parfum,$90.00 - $158.00,4.5,508.0
Fragrance,Jimmy Choo,Jimmy Choo Eau de Parfum,$35.00 - $109.00,4.6,530.0
Fragrance,Burberry,Brit For Her Eau de Parfum,$120.00,4.7,739.0
Fragrance,NOYZ,The Solid Fragrance - Only Human,$42.00,4.7,110.0
Fragrance,Gucci,Flora Eau de Parfum 2-Piece Gift Set,$160.00,5.0,2.0
Fragrance,Carolina Herrera,Best-selling Good Girl and Very Good Girl Glam Mini Duo,$40.00,4.1,13.0
Fragrance,Ralph Lauren,Polo Blue Eau de Toilette,$99.00 - $160.00,4.5,4440.0
Fragrance,Prada,Luna Rossa Carbon Eau de Parfum,$35.00 - $155.00,4.8,1024.0
Fragrance,Lancôme,Trésor Eau de Parfum,$90.00 - $162.00,4.7,635.0
Fragrance,MUGLER,Alien Pulp Eau de Parfum Fruity,$35.00 - $159.00,4.5,889.0
Fragrance,Dior,Addict Purple Glow Eau de Parfum,$98.00 - $150.00,4.5,168.0
Fragrance,OUAI,Melrose Place Eau de Parfum,$26.00 - $64.00,4.4,181.0
Fragrance,Versace,Dylan Purple Eau de Parfum 2 Piece Gift Set,$89.00,4.4,21.0
Fragrance,Montblanc,Legend Eau de Parfum,$95.00 - $160.00,4.6,1660.0
Fragrance,Ariana Grande,Ari Eau de Parfum,$50.00 - $72.00,4.6,734.0
Fragrance,NOYZ,Discovery Kit Eau De Parfum,$38.00,4.4,33.0
Fragrance,Dior,Dior Homme Eau de Toilette,$112.00 - $171.00,4.5,3366.0
Fragrance,Viktor&Rolf,Spicebomb Extreme Eau de Parfum,$110.00 - $155.00,4.6,711.0
Fragrance,Prada,L'Homme Eau de Toilette,$136.00,,
Fragrance,Gucci,Guilty Pour Femme Eau de Parfum,$111.00 - $181.00,4.4,1540.0
Fragrance,Touchland,Cashmere Woods Body & Hair Fragrance Mist,$20.00,4.4,334.0
Fragrance,Calvin Klein,Euphoria Elixir Parfum Intense Travel Spray Discovery Set,$50.00,5.0,1.0
Fragrance,Ralph Lauren,Polo Red Eau de Toilette,$99.00 - $160.00,4.7,1152.0
Fragrance,BETTER WORLD FRAGRANCE HOUSE,Summer Mink 2-Piece Gift Set,$160.00,4.4,7.0
Fragrance,LE MONDE GOURMAND,Coffret de Parfum Set,$44.00,4.6,8.0
Fragrance,Rabanne,Fame Parfum,$105.00 - $185.00,4.5,488.0
Fragrance,Ariana Grande,Thank U Next Eau de Parfum,$28.00 - $72.00,4.0,1326.0
Fragrance,Juicy Couture,Just Moi Eau de Parfum,$35.00 - $143.00,4.7,2156.0
Fragrance,NEST New York,Santa Barbara Strawberry Eau de Parfum,$32.00 - $98.00,4.3,152.0
Fragrance,Juicy Couture,Viva La Juicy Gold Couture Eau de Parfum,$105.00 - $129.00,4.6,2744.0
Fragrance,Sweet & Shimmer,Juicy Melon Hair & Body Mist,$4.99,5.0,1.0
Fragrance,Philosophy,Amazing Grace and Fresh Cream Warm Cashmere 2-Piece Mini Gift Set,$35.00,4.6,18798.0
Fragrance,Aramis,Intuition Eau de Parfum,$30.00 - $130.00,4.5,1167.0
Fragrance,Sabrina Carpenter,Bite Sized Coffret Eau de Parfum,$45.00,3.9,16.0
Fragrance,Jimmy Choo,Fever Eau de Parfum,$35.00 - $140.00,4.7,582.0
Fragrance,Dolce&Gabbana,Dolce Eau de Parfum,$152.00,4.6,163.0
Fragrance,Clinique,My Happy Peony Picnic Perfume Spray,$26.25 - $81.00,4.6,138.0
Fragrance,Jimmy Choo,Jimmy Choo I Want Choo Trio Set,$49.00,4.0,1.0
Fragrance,Azzaro,Wanted Eau de Parfum,$105.00 - $130.00,4.7,3378.0
Fragrance,MAC,Turquatic Fragrance Blend Perfume Spray,$70.00,4.4,622.0
Fragrance,Dolce&Gabbana,Light Blue Pour Homme Eau De Parfum,$38.00 - $160.00,4.7,57.0
Fragrance,DIME,7 Summers Eau de Parfum,$25.00 - $62.00,4.7,5235.0
Fragrance,Ralph Lauren,Polo Black Eau de Toilette,$116.00,4.7,742.0
Fragrance,Dolce&Gabbana,Dolce Blue Jasmine Eau de Parfum,$38.00 - $152.00,4.1,229.0
Fragrance,Miu Miu,Miutine Eau de Parfum Discovery Set,$39.00,4.0,13.0
Fragrance,florence by mills,Love Core Hair & Body Mist,$18.00,4.6,50.0
Fragrance,Snif,Extra Whip Body Mist,$24.00 - $38.00,4.9,726.0
Fragrance,Burberry,Hero Parfum Intense,$171.00 - $209.00,4.6,750.0
Fragrance,Tiffany & Co.,Rose Gold Intense Eau de Parfum,$118.00 - $190.00,4.4,1284.0
Fragrance,Chloé,L'Eau de Parfum Lumineuse,$40.00 - $150.00,4.4,1161.0
Fragrance,TOM FORD,Café Rose Eau de Parfum,$55.00 - $240.00,4.2,864.0
Fragrance,Nemat,Egyptian Musk Fragrance Oil Roll-On,$20.99,4.4,106.0
Fragrance,Carolina Herrera,Good Girl Blush Perfumed Body Mist,$46.00,4.5,1208.0
Fragrance,TOM FORD,Eau de Soleil Blanc Eau de Toilette,$45.00 - $200.00,3.9,12.0
Fragrance,Sweet & Shimmer,Vanilla Dream Hair & Body Mist,$4.99,3.0,4.0
Fragrance,Kopari Beauty,Pink Guava Hair & Body Mist,$16.00 - $29.00,4.5,170.0
Fragrance,TOM FORD,Black Orchid Eau de Parfum,$55.00 - $240.00,4.3,943.0
Fragrance,Dior,Miss Dior Blooming Bouquet Eau de Toilette Roller-Pearl,$49.00,4.6,7777.0
Fragrance,Jimmy Choo,Man Extreme Eau de Parfum,$106.00 - $136.00,4.6,617.0
Fragrance,Ralph Lauren,Polo Blue Parfum,$115.00 - $148.00,4.5,4440.0
Fragrance,Valentino,Donna Born in Roma Discovery Fragrance Gift Set,$50.00,1.0,1.0
Fragrance,NOYZ,12:00 Eau de Parfum,$38.00 - $85.00,4.7,897.0
Fragrance,LE MONDE GOURMAND,Potion Enchantee Eau de Parfum,$30.00,4.1,7.0
Fragrance,Azzaro,Chrome Eau de Toilette,$55.00 - $145.00,4.7,531.0
Fragrance,KHLOÉ KARDASHIAN,XO KHLOÉ Hair Mist,$32.00,4.4,19.0
Fragrance,CHANEL,COCO MADEMOISELLE Eau de Toilette Spray,$124.00 - $155.00,4.3,38.0
Fragrance,Ralph Lauren,Blue Eau de Toilette,$110.00,4.5,4440.0
Fragrance,Versace,Bright Crystal & Crystal Noir Mini Duo,$30.00,4.5,6.0
Fragrance,Eos,Cashmere Body Mist,$14.99,4.9,177.0
Fragrance,Coach,Dreams Trio Set,$49.00,,
Fragrance,Carolina Herrera,Good Girl Blush Bowtastic Collector's Edition Eau de Parfum,$180.00,4.5,1208.0
Fragrance,Philosophy,Pure Grace Eau de Parfum,$77.00,4.2,1033.0
Fragrance,Dior,Addict Peachy Glow Eau de Parfum,$98.00 - $150.00,4.2,351.0
Fragrance,Carolina Herrera,Good Girl Eau de Parfum 2-Piece Gift Set,$99.00,4.7,2789.0
Fragrance,Dolce&Gabbana,Dolce Eau de Parfum Perfume Gel,$59.00,4.3,108.0
Fragrance,Estée Lauder,Fragrance Treasures Gift Set,$42.00,4.4,16.0
Fragrance,Marc Jacobs,Perfect Eau de Parfum Duo Gift Set,$100.00,4.6,3203.0
Fragrance,Ellis Brooklyn,SWEET Eau de Parfum,$33.00 - $115.00,4.5,137.0
Fragrance,Gucci,Bloom Eau de Parfum Intense,$40.00 - $180.00,4.3,701.0
Fragrance,Yves Saint Laurent,Libre Eau de Parfum 2-Piece Travel Gift Set,$115.00,,
Fragrance,Clinique,Happy For Men Cologne Spray,$56.25 - $75.00,4.7,301.0
Fragrance,Jimmy Choo,L'Eau Eau de Toilette,$71.00 - $98.00,4.5,196.0
Fragrance,Montblanc,Montblanc Explorer Extreme Parfum,$112.00 - $146.00,4.7,484.0
Fragrance,Kate Spade New York,Pop Eau de Parfum,$29.00 - $104.00,4.7,290.0
Fragrance,Viktor&Rolf,Mini Flowerbomb Perfume Gift Set,$35.00,4.9,333.0
Fragrance,NOYZ,The Solid Fragrance - Detour,$42.00,4.9,91.0
Fragrance,Orebella,WINDOW2SOUL Parfum,$35.00 - $100.00,4.5,855.0
Fragrance,Viktor&Rolf,Spicebomb Night Vision Eau de Toilette,$138.00,4.3,231.0
Fragrance,Rabanne,Phantom in Red Parfum Elixir,$117.00 - $150.00,4.5,194.0
Fragrance,Touchland,Mango Mojo Body & Hair Fragrance Mist,$20.00,4.4,334.0
Fragrance,Yves Saint Laurent,La Nuit de L'Homme Eau de Toilette,$105.00,4.7,115.0
Fragrance,Dolce&Gabbana,K by Dolce&Gabbana Eau de Toilette,$112.00 - $134.00,4.7,73.0
Fragrance,Nemat,White Musk Fragrance Oil Roll-On,$20.99,3.7,68.0
Fragrance,Ralph Lauren,Polo 67 Eau de Parfum Extreme,$135.00,4.7,1778.0
Fragrance,NEST New York,Indigo Eau de Parfum,$32.00 - $92.00,4.5,133.0
Fragrance,LE MONDE GOURMAND,Lait de Coco Fresh Body Mist,$18.00,4.3,11.0
Fragrance,Versace,Eau Fraiche Extreme Eau de Parfum,$109.00 - $139.00,4.5,429.0
Fragrance,Tory Burch,Sublime by Tory Burch Eau de Parfum,$35.00 - $155.00,4.4,322.0
Fragrance,Yves Saint Laurent,L'Homme Le Parfum,$160.00,4.4,92.0
Fragrance,Carolina Herrera,Good Girl Blush Valentine's Edition Eau de Parfum,$184.00,4.7,2789.0
Fragrance,Givenchy,Irresistible Nectar Eau de Parfum,$99.00 - $167.00,4.6,485.0
Fragrance,Kopari Beauty,Kaanapali Coast Hair & Body Mist,$16.00 - $29.00,4.5,231.0
Fragrance,Carolina Herrera,Bad Boy Elixir Eau de Parfum,$40.00 - $182.00,4.4,272.0
Fragrance,Clinique,Aromatics Elixir Eau de Parfum Spray,$26.25 - $88.50,4.0,938.0
Fragrance,Estée Lauder,Pleasures Eau de Parfum Perfume Spray,$88.00 - $118.00,4.7,712.0
Fragrance,Lancôme,Idôle Power Eau De Parfum Intense,$72.00 - $162.00,4.5,737.0
Fragrance,Montblanc,Legend Spirit Eau de Toilette,$37.00 - $112.00,4.7,536.0
Fragrance,NEST New York,Lychee Rose Perfume Oil,$35.00 - $108.00,4.6,222.0
Fragrance,CHANEL,CHANCE Eau de Toilette Spray,$124.00 - $155.00,4.4,32.0
Fragrance,Montblanc,Legend Blue Eau de Parfum,$95.00 - $130.00,4.6,416.0
Fragrance,Juicy Couture,Viva La Juicy Eau de Parfum 4-Piece Discovery Set,$50.00,3.5,4.0
Fragrance,Valentino,Donna Born in Roma Eau de Parfum Mother's Day Gift Set with Travel Spray,$150.00,,
Fragrance,Snif,Rose Era Eau de Toilette,$26.00 - $68.00,4.8,1493.0
Fragrance,Burberry,Hero Elixir de Parfum,$199.00,4.7,707.0
Fragrance,Dior,Fahrenheit Eau de Toilette,$112.00 - $135.00,4.4,84.0
Fragrance,NEST New York,Crème De Clementine Eau de Parfum,$32.00 - $98.00,4.3,154.0
Fragrance,Dolce&Gabbana,My Devotion & Devotion EDPI Mini Set,$35.00,3.0,2.0
Fragrance,Moroccanoil,L'Originale & Lumière du Jour Eau de Parfum 2-Piece Deluxe Mini Set,$30.00,4.0,2.0
Fragrance,NEST New York,Santa Barbara Strawberry Perfume Oil,$35.00 - $108.00,4.4,345.0
Fragrance,LE MONDE GOURMAND,Le Beach Eau de Parfum,$28.00,4.5,16.0
Fragrance,Dior,Miss Dior Rose N'Roses Eau de Toilette,$98.00 - $188.00,4.2,3376.0
Fragrance,Snif,Snack Pack Sample Set Eau de Toilette,$19.00,4.4,5.0
Fragrance,Prada,Luna Rossa Discovery Set,$45.00,5.0,3.0
Fragrance,Givenchy,Gentleman Boisee Eau de Parfum,$130.00 - $225.00,4.6,960.0
Fragrance,Ralph Lauren,Polo Red Eau de Parfum Extreme,$35.00 - $135.00,4.6,1662.0
Fragrance,Juicy Couture,Viva La Juicy Le Bubbly Eau De Parfum,$33.00 - $129.00,4.6,1099.0
Fragrance,Dolce&Gabbana,The One For Men Eau de Toilette,$112.00,4.7,149.0
Fragrance,Lake & Skye,11 11 Fragrance Oil Rollerball,$48.00,4.6,1769.0
Fragrance,Philosophy,Pure Grace Eau de Toilette,$28.00 - $88.00,4.5,3799.0
Fragrance,NEST New York,Balinese Coconut Eau de Parfum,$32.00 - $98.00,4.6,176.0
Fragrance,Viktor&Rolf,Mini Flowerbomb Perfume Set,$35.00,4.7,165.0
Fragrance,Touchland,Golden Amber Body & Hair Fragrance Mist,$20.00,4.4,334.0
Fragrance,NOYZ,The Solid Fragrance - Rinse Cycle,$42.00,,
Fragrance,LE MONDE GOURMAND,Chai Épicé Eau De Parfum,$28.00,4.6,178.0
Fragrance,Vacation,“GRAND CUVÉE” by Vacation Eau de Toilette,$60.00,4.5,320.0
Fragrance,Yves Saint Laurent,L'Homme Eau De Parfum,$138.00,4.7,864.0
Fragrance,Dior,Dior Homme Cologne Eau de Toilette,$114.00 - $187.00,4.7,94.0
Fragrance,ARMANI,Armani Code Eau de Toilette,$65.00 - $139.00,4.6,1400.0
Fragrance,Versace,Dylan Turquoise Eau De Toilette,$92.00 - $115.00,4.5,920.0
Fragrance,Ariana Grande,r.e.m. Cherry Eclipse 2 Piece Set,$32.00,5.0,1.0
Fragrance,CHANEL,COCO MADEMOISELLE Eau de Parfum Twist and Spray,$171.00,4.4,40.0
Fragrance,Marc Jacobs,Daisy Wild Eau de Parfum Duo Gift Set,$100.00,4.5,1072.0
Fragrance,Dior,Sauvage Deodorant Stick,$38.00,4.4,242.0
Fragrance,Snif,Hot Cakes + Toppings Layering Bundle,$79.00,4.8,536.0
Fragrance,Carolina Herrera,Good Girl and Good Girl Jasmine Absolute Mini Duo Set,$40.00,,
Fragrance,NEST New York,Madagascar Vanilla Perfume Oil,$35.00 - $108.00,4.4,322.0
Fragrance,NEST New York,Vanilla Bourbon Eau de Parfum,$32.00 - $98.00,4.5,328.0
Fragrance,CHANEL,ALLURE HOMME SPORT EAU EXTRÊME Eau de Parfum Spray,$173.00,5.0,6.0
Fragrance,Snif,Soda Snob Eau de Toilette,$68.00,4.9,1000.0
Fragrance,Dior,Miss Dior Eau de Parfum Roller-Pearl,$60.00,4.6,9774.0
Fragrance,NOYZ,Sh**ty Day Eau de Parfum,$38.00 - $85.00,4.5,357.0
Fragrance,Dolce&Gabbana,Dolce Violet Eau de Toilette Perfume Gel,$59.00,4.2,107.0
Fragrance,Philosophy,Fresh Cream Warm Cashmere Eau de Toilette Duo Gift Set,$58.00,5.0,2.0
Fragrance,NEST New York,Madagascar Vanilla Eau de Parfum,$32.00 - $98.00,4.7,264.0
Fragrance,Estée Lauder,Beautiful Magnolia Eau de Parfum Spray,$32.00 - $150.00,4.8,7820.0
Fragrance,Ariana Grande,Cloud 2.0 Intense Eau de Parfum,$72.00,4.2,449.0
Fragrance,method,Body and Hair Mist,$7.00 - $14.00,4.5,909.0
Fragrance,Gucci,Guilty Elixir de Parfum Pour Homme,$195.00,4.4,1025.0
Fragrance,Rabanne,Million Gold Elixir,$142.00 - $182.00,4.6,215.0
Fragrance,NOYZ,The Solid Fragrance - Unmute,$42.00,4.7,188.0
Fragrance,Gucci,Guilty Pour Femme Eau de Parfum Intense,$118.00 - $190.00,4.1,855.0
Fragrance,Dolce&Gabbana,Dolce Blue Jasmine Eau de Parfum Perfume Gel,$59.00,4.3,107.0
Fragrance,KHLOÉ KARDASHIAN,XO KHLOÉ & ALMOST ALWAYS Deluxe Mini Duo Set,$32.00,3.0,5.0
Fragrance,NEST New York,Balinese Coconut Perfume Oil,$35.00 - $108.00,4.5,278.0
Fragrance,Squishmallows Fragrances,Whisked Away Tropical Sunset Limited Edition,$58.00,,
Fragrance,Yves Saint Laurent,Mon Paris Intensément Eau de Parfum,$162.00,4.5,270.0
Fragrance,MUGLER,Alien Extraintense Eau de Parfum Intense,$37.00 - $185.00,4.3,924.0
Fragrance,Sabrina Carpenter,Sweet Tooth Eau de Parfum,$35.00 - $55.00,4.9,1259.0
Fragrance,Ariana Grande,R.E.M. Eau de Parfum,$28.00 - $72.00,4.4,1103.0
Fragrance,LE MONDE GOURMAND,Santal Supreme Eau De Parfum,$28.00,4.2,84.0
Fragrance,Gucci,Bloom Parfum,$40.00 - $180.00,4.6,499.0
Fragrance,Estée Lauder,Bronze Goddess Eau Fraîche Eau de Toilette,$88.00 - $102.00,3.9,163.0
Fragrance,Tiffany & Co.,Tiffany Eau de Parfum,$111.00 - $178.00,4.3,594.0
Fragrance,Snif,Bestseller Sample Set Eau de Toilette,$19.00,4.8,484.0
Fragrance,Viktor&Rolf,Spicebomb Mini Cologne Gift Set,$30.00,4.7,376.0
Fragrance,NEST New York,Indian Jasmine Perfume Oil,$35.00 - $108.00,4.5,132.0
Fragrance,Givenchy,Gentleman Eau de Parfum Réserve Privée,$130.00 - $225.00,4.6,472.0
Fragrance,Miu Miu,L'Eau de Muguet Eau de Parfum,$108.00 - $172.00,4.6,10.0
Fragrance,Dolce&Gabbana,Q by Dolce&Gabbana Eau de Parfum,$38.00 - $179.00,4.2,472.0
Fragrance,Coach,Cherry Parfum,$37.00 - $138.00,4.7,227.0
Fragrance,CHANEL,GABRIELLE CHANEL ESSENCE Eau de Parfum Spray,$162.00 - $195.00,4.5,55.0
Fragrance,Lake & Skye,11 11 Azure Eau de Parfum,$36.00 - $105.00,4.4,1310.0
Fragrance,Dolce&Gabbana,K by Dolce&Gabbana Parfum,$190.00,4.5,108.0
Fragrance,Lake & Skye,11 11 Moon Eau de Parfum,$32.00 - $105.00,4.4,539.0
Fragrance,TOM FORD,Eau D'Ombre Leather Eau de Toilette,$45.00 - $200.00,5.0,7.0
Fragrance,Dior,Dior Homme Sport Eau de Toilette,$114.00 - $187.00,4.6,1641.0
Fragrance,Snif,Crumb Couture Eau de Toilette,$26.00 - $68.00,4.9,2517.0
Fragrance,Coach,Dreams Mini Duo Set,$29.00,3.1,8.0
Fragrance,Yves Saint Laurent,Libre Eau de Parfum Valentine's Day Gift Set with Mirror,$155.00,,
Fragrance,Marc Jacobs,Daisy Eau de Toilette and Wild Travel Spray Duo Gift Set,$49.00,,
Fragrance,Ralph Lauren,Polo Red Parfum,$115.00 - $148.00,4.5,2560.0
Fragrance,Donna Karan,Cashmere Mist Discovery Set Duo,$35.00,4.3,13.0
Fragrance,Lancôme,Idôle Now Eau De Parfum,$69.00 - $157.00,4.6,548.0
Fragrance,Jimmy Choo,Jimmy Choo I Want Choo Mini Duo Set,$35.00,,
Fragrance,Ariana Grande,Ariana Grande 4-Piece Body Mist Coffret,$18.00,1.0,1.0
Fragrance,Juicy Couture,Viva La Juicy and Just Moi Eau de Parfum 2 Piece Mini Gift Set,$30.00,4.0,7.0
Fragrance,LE MONDE GOURMAND,Fraise Fouettée Eau de Parfum,$28.00,4.5,62.0
Fragrance,Givenchy,Irresistible Rose Velvet Eau de Parfum,$110.00 - $167.00,4.7,1739.0
Fragrance,Lancôme,La Vie Est Belle Mother's Day Fragrance Set with Perfume & Body Lotion,$97.00,,
Fragrance,Marc Jacobs,Daisy Eau de Toilette Duo Gift Set,$87.00,4.7,6792.0
Fragrance,Beekman 1802,Travel Size Milk Shake Moisture Mist for Body,$29.00,4.7,1479.0
Fragrance,NEST New York,Born To Travel Trio,$73.00,,
Fragrance,Philosophy,Amazing Grace Eau de Toilette Duo Gift Set,$67.00,,
Fragrance,LE MONDE GOURMAND,Fete de Vanille Eau de Parfum,$30.00,4.0,5.0
Fragrance,Rare Beauty,Find Comfort Bouncy Body Cream - Awaken Confidence,$36.00,4.9,251.0
Fragrance,Philosophy,Radiant Grace Eau de Parfum,$28.00 - $98.00,4.6,18798.0
Fragrance,DKNY,Be Delicious Eau de Parfum,$58.00 - $100.00,4.7,548.0
Fragrance,Tory Burch,Signature Eau de Parfum,$35.00 - $155.00,4.6,115.0
Fragrance,Tiffany & Co.,Rose Gold Eau de Parfum 3-Piece Gift Set,$178.00,,
Fragrance,TOM FORD,Noir Extreme Eau de Parfum,$165.00 - $240.00,4.6,717.0
Fragrance,Pureology,Love Luster Hydrating Hair Perfume,$44.00,4.6,266.0
Fragrance,Prada,Luna Rossa Ocean Le Parfum,$36.00 - $186.00,4.6,937.0
Fragrance,Dior,J'adore Eau de Parfum Roller-Pearl,$60.00,4.6,3023.0
Fragrance,Dior,J'adore Eau Lumière Eau de Toilette,$145.00,4.8,107.0
Fragrance,Nemat,Musk Amber Fragrance Oil Roll-On,$20.99,3.8,39.0
Fragrance,Vera Wang,Vera Wang Love Eau de Parfum,$26.00 - $85.00,4.7,550.0
Fragrance,Philosophy,Amazing Grace Ballet Rose Eau de Toilette,$67.00,4.6,1081.0
Fragrance,Ellis Brooklyn,SALT Eau de Parfum,$33.00 - $115.00,4.4,170.0
Fragrance,Miu Miu,Rose Eau de Toilette,$162.00,5.0,4.0
Fragrance,Dior,Pure Poison Eau de Parfum,$149.00,4.3,117.0
Fragrance,OUAI,North Bondi Eau de Parfum,$26.00 - $64.00,4.2,136.0
Fragrance,CHANEL,CHANCE EAU TENDRE Eau de Toilette Twist and Spray,$129.00,4.7,30.0
Fragrance,Prada,Candy Eau de Parfum Mini And Travel Spray Set,$40.00,4.7,7078.0
Fragrance,Clinique,Happy in Paradise Eau de Parfum,$81.00,4.0,37.0
Fragrance,MUGLER,ALIEN Mini 2-Piece Discovery Set,$32.00,4.4,5.0
Fragrance,Snif,Sweet Ash Eau de Toilette,$26.00 - $68.00,4.8,1394.0
Fragrance,CHANEL,CHANCE EAU VIVE Eau de Toilette Spray,$155.00,4.6,15.0
Fragrance,CHANEL,N°5 Eau de Toilette Spray,$163.00,4.5,21.0
Fragrance,Dolce&Gabbana,Q by Dolce&Gabbana Parfum,$192.00,4.4,118.0
Fragrance,The Nue Co. ,Us Pheromone+ Connect Eau de Parfum,$38.00 - $125.00,4.7,36.0
Fragrance,LE MONDE GOURMAND,Fleur de Blonde Eau de Parfum,$28.00,4.8,25.0
Fragrance,Givenchy,Gentleman Society Eau de Parfum,$134.00 - $227.00,4.7,678.0
Fragrance,NEST New York,Perfume Oil​ Discovery Set,$26.00,5.0,2.0
Fragrance,Valentino,Born In Roma Perfumed Hair & Body Mist,$65.00,3.0,11.0
Fragrance,Lake & Skye,11 11 Vanilla Eau de Parfum,$36.00 - $148.00,4.3,209.0
Fragrance,Snif,Crumb Couture Gift Set Eau de Toilette,$55.30,4.9,2517.0
Fragrance,TOM FORD,Bois Pacifique Eau de Parfum,$165.00 - $240.00,5.0,5.0
Fragrance,Aramis,Intuition by Aramis 2-Piece Gift Set,$95.00,5.0,2.0
Fragrance,Givenchy,Irresistible Very Floral Eau De Parfum,$143.00 - $167.00,4.7,504.0
Fragrance,Rare Beauty,Find Comfort Body & Hair Fragrance Mist - Awaken Confidence,$28.00,4.9,250.0
Fragrance,LE MONDE GOURMAND,000 Eau De Parfum,$28.00,3.7,7.0
Fragrance,Snif,Naughty Nonna Eau de Toilette,$68.00,4.9,848.0
Fragrance,Kate Spade New York,Bloom Eau De Toilette,$29.00 - $99.00,4.7,302.0
Fragrance,Clinique,Clinique Happy Body Spritz Fragrance Spray,$25.50,4.5,456.0
Fragrance,DIME,Dans Les Bois Eau de Toilette,$62.00,4.4,5091.0
Fragrance,Clinique,Find Your Happy Mini Fragrance Set,$11.25,,
Fragrance,Coach,Dreams Starlight Eau de Parfum 2 Piece Set,$112.00,,
Fragrance,Lancôme,Miracle Eau de Parfum,$99.00 - $137.00,4.7,126.0
Fragrance,KYLIE COSMETICS,Cosmic Kylie Jenner Eau de Parfum 2-Piece Travel Spray Gift Set,$39.00,4.2,24.0
Fragrance,NEST New York,Lychee Rose Eau de Parfum,$98.00,4.3,44.0
Fragrance,Dior,J'adore Eau de Parfum Mother's Day Perfume Set,$198.00,,
Fragrance,Hempz,Sweet Hydration Mini Body Moisturizer Spray Kit,$19.99,2.0,2.0
Fragrance,NEST New York,Eau de Parfum​ Discovery Set,$46.00,5.0,1.0
Fragrance,Philosophy,Grace Discovery 3-Piece Mini Gift Set,$59.00,5.0,1.0
Fragrance,Tiffany & Co.,Tiffany & Love Eau de Parfum 3-Piece Gift Set,$181.00,,
Fragrance,Viktor&Rolf,Spicebomb Metallic Musk Eau De Parfum,$155.00,4.7,840.0
Fragrance,NEST New York,Santa Barbara Strawberry Body Mist,$39.00,4.2,147.0
Fragrance,Yves Saint Laurent,Black Opium Eau de Parfum 2-Piece Travel Gift Set,$100.00,,
Fragrance,LE MONDE GOURMAND,Sel Océan Fresh Body Mist,$18.00,5.0,6.0
Fragrance,CHANEL,COCO MADEMOISELLE Hair Perfume,$85.00,4.8,17.0
Fragrance,Ralph Lauren,Romance Eau de Parfum Intense,$35.00 - $144.00,4.5,963.0
Fragrance,LE MONDE GOURMAND,Crème Vanille Fresh Body Mist,$18.00,3.6,46.0
Fragrance,Yves Saint Laurent,Mon Paris Lumiere Eau de Toilette,$125.00,4.7,817.0
Fragrance,Dolce&Gabbana,Dolce Lily Eau de Toilette,$135.00,4.1,56.0
Fragrance,Philosophy,Fresh Cream Eau de Toilette,$58.00,4.6,18798.0
Fragrance,HERBIVORE,COCO ROSE Coconut + Tremella Milky Body Mist,$12.00 - $28.00,4.4,93.0
Fragrance,Dolce&Gabbana,Dolce Violet Eau de Toilette,$108.00 - $135.00,4.2,472.0
Fragrance,Odele,Signature Hair Scent - Oakmoss Ylang Ylang,$16.99,4.4,145.0
Fragrance,Clinique,Happy Perfume Rollerball,$24.00,4.6,349.0
Fragrance,CHANEL,GABRIELLE CHANEL Eau de Parfum Spray,$154.00 - $185.00,4.1,30.0
Fragrance,TOM FORD,Velvet Orchid Eau de Parfum,$165.00 - $240.00,4.4,31.0
Fragrance,Snif,Gourmand Lovers Mini Bundle Eau de Toilette,$68.00,4.9,176.0
Fragrance,Kate Spade New York,Cherie Je t’aime Eau de Parfum,$57.00 - $99.00,4.6,13.0
Fragrance,Dior,Sauvage Spray For The Wild Travel Fragrance Eau de Parfum with Case,$132.00,5.0,1.0
Fragrance,Miu Miu,L'Eau Bleue Eau de Parfum,$108.00 - $172.00,4.6,8.0
Fragrance,LE MONDE GOURMAND,Melodie de Thé Eau de Parfum,$30.00,3.7,3.0
Fragrance,Tree Hut,Tropic Glow Shimmer Mist,$10.49,4.2,166.0
Fragrance,Calvin Klein,Eternity Eau de Parfum,$123.00,4.7,158.0
Fragrance,Rare Beauty,Find Comfort Hydrating Hand Cream,$18.00,4.8,420.0
Fragrance,CHANEL,ALLURE Eau de Toilette Spray,$124.00 - $155.00,4.6,21.0
Fragrance,Chloé,L’Eau de Parfum Intense,$40.00 - $190.00,4.4,1161.0
Fragrance,Donna Karan,Cashmere Mist Eau de Parfum,$32.00 - $135.00,4.6,347.0
Fragrance,Uni,Sunset Water-Based Perfume,$28.00 - $72.00,4.7,12.0
Fragrance,Dolce&Gabbana,Dolce Garden Eau de Parfum,$152.00,4.5,135.0
Fragrance,Essence,Juicy Bomb Body Mist,$6.99,3.8,38.0
Fragrance,Dior,Miss Dior Parfum Roller-Pearl,$66.00,5.0,3.0
Fragrance,LE MONDE GOURMAND,Pistachio Brûlée Eau De Parfum,$28.00,4.2,99.0
Fragrance,Ariana Grande,Sweet Like Candy By Ariana Grande 2-Piece Set,$32.00,4.8,5.0
Fragrance,KRISTIN ESS HAIR,The One Signature Hair Perfume,$19.00,4.5,101.0
Fragrance,Odele,Hair + Body Mist - Pink Pepper Santal,$16.99,4.4,147.0
Fragrance,KYLIE COSMETICS,Cosmic Kylie Jenner & Cosmic Kylie Jenner Intense Eau de Parfum Duo Gift Set,$39.00,,
Fragrance,LE MONDE GOURMAND,Rouge de Couer Eau de Parfum,$30.00,4.0,1.0
Fragrance,Billie Eilish,Eilish & Eilish No. 2 Duo Rollerball,$28.00,4.5,31.0
Fragrance,Viktor&Rolf,Spicebomb Eau de Toilette,$138.00,4.6,711.0
Fragrance,Burberry,Brit For Men Eau de Toilette,$110.00,4.7,120.0
Fragrance,Givenchy,Gentleman Society Ambrée Eau de Parfum,$168.00,4.7,395.0
Fragrance,Gucci,Gucci Eau de Parfum and Eau de Toilette Travel Spray 3-Piece Gift Set,$80.00,5.0,1.0
Fragrance,Clinique,My Happy Indigo Mist Perfume Spray,$26.25,4.5,79.0
Fragrance,NOYZ,Love Club Eau De Parfum,$38.00 - $85.00,4.0,241.0
Fragrance,Versace,Crystal Travel Spray Gift Set,$44.00,4.6,16.0
Fragrance,Gucci,Bloom Eau de Toilette,$40.00 - $141.00,4.5,5135.0
