category,brand,name,price,avg_rating,num_ratings
Fragrance,APOTHEKE,Charcoal Reed Diffuser,$48.00,4.8,109.0
Fragrance,APOTHEKE,Earl Grey Bitters Reed Diffuser Liquid Refill,$33.60,4.9,13.0
Fragrance,APOTHEKE,White Vetiver Reed Diffuser,$48.00,4.9,85.0
Fragrance,APOTHEKE,"Canvas Pura Smart Scent Fragrance Refill, Set of 2",$36.00,5.0,2.0
Fragrance,APOTHEKE,Canvas Reed Diffuser Liquid Refill,$33.60,5.0,8.0
Fragrance,APOTHEKE,Canvas Reed Diffuser,$48.00,5.0,28.0
Fragrance,APOTHEKE,Sea Salt Grapefruit Reed Diffuser Liquid Refill,$33.60,4.9,8.0
Fragrance,APOTHEKE,Sea Salt Grapefruit Reed Diffuser,$48.00,4.9,51.0
Fragrance,APOTHEKE,Earl Grey Bitters Reed Diffuser,$48.00,4.9,36.0
Fragrance,APOTHEKE,"Charcoal Pura Smart Scent Fragrance Refill, Set of 2",$36.00,4.9,14.0
Fragrance,APOTHEKE,Bergamot Tangerine Reed Diffuser,$48.00,5.0,2.0
Fragrance,APOTHEKE,Charcoal Reed Diffuser Liquid Refill,$33.60,5.0,11.0
Fragrance,APOTHEKE,White Vetiver Reed Diffuser Liquid Refill,$33.60,4.9,14.0
Fragrance,APOTHEKE,Earl Grey Bitters Scented Candle,$21.25 - $36.80,4.9,53.0
Fragrance,APOTHEKE,Verdant Garden Petite Scented Candle,$21.25,,
Fragrance,Nopalera,Perfume,$78.00,5.0,9.0
Fragrance,APOTHEKE,Bergamot Tangerine Scented Candle,$25.00 - $36.80,5.0,4.0
Fragrance,Nopalera,Travel Perfume,$30.00,4.4,508.0
Fragrance,APOTHEKE,Charcoal Scented Candle,$21.25 - $36.80,4.9,207.0
Fragrance,APOTHEKE,Sea Salt Grapefruit Scented Candle,$21.25 - $36.80,4.9,54.0
Fragrance,APOTHEKE,White Vetiver Scented Candle,$21.25 - $36.80,4.9,57.0
Fragrance,APOTHEKE,Hinoki Lavender Petite Scented Candle,$21.25,5.0,2.0
Fragrance,APOTHEKE,Canvas Scented Candle,$25.00 - $36.80,4.9,23.0
Fragrance,Hawkins & Brimble,Ultimate Fragrance Bundle,$93.00,,
Fragrance,Hawkins & Brimble,Signature Fragrance Set,$66.00,,
Fragrance,Marie Hunter,Leather Lipstick Case,$70.00,5.0,1.0
Fragrance,Marie Hunter,Bourbon Vanilla Candle,$60.00,5.0,2.0
Fragrance,Marie Hunter,Magnolia Blossom Candle,$60.00,5.0,1.0
Fragrance,Marie Hunter,Peony Candle,$60.00,,
Fragrance,Marie Hunter,Leather & Suede Candle,$60.00,5.0,2.0
Fragrance,Marie Hunter,Prosecco Candle,$60.00,5.0,1.0
Fragrance,Nopalera,Hand Cream + Travel Perfume Set,$25.20,5.0,3.0
Fragrance,Nopalera,Travel Fragrance Trio Gift Set,$52.50,4.7,3.0
Fragrance,Caswell-Massey,2571 Eau de Parfum,$40.00 - $200.00,,
Fragrance,Caswell-Massey,Sandalwood Eau de Toilette,$30.00 - $125.00,,
Fragrance,Caswell-Massey,Almond Eau de Toilette,$30.00 - $125.00,5.0,1.0
Fragrance,Caswell-Massey,OAIRE Eau de Parfum,$40.00 - $200.00,,
Fragrance,Caswell-Massey,Explorer Discovery Set,$75.00,,
Fragrance,Caswell-Massey,Orchid Perfume,$40.00 - $150.00,,
Fragrance,Caswell-Massey,Marem Perfume,$40.00 - $150.00,,
Fragrance,Caswell-Massey,Rose Perfume,$40.00 - $150.00,,
Fragrance,Caswell-Massey,Elixir of Love Eau de Toilette,$30.00 - $125.00,5.0,2.0
Fragrance,Caswell-Massey,LX48 Eau de Parfum,$40.00 - $200.00,,
Fragrance,Caswell-Massey,Jockey Club Eau de Parfum,$40.00 - $200.00,,
Fragrance,Caswell-Massey,Number Six Eau de Parfum,$40.00 - $225.00,,
Fragrance,Caswell-Massey,RÒS Eau de Parfum,$40.00 - $200.00,,
Fragrance,Caswell-Massey,Newport Cologne,$30.00 - $80.00,,
Fragrance,Caswell-Massey,Greenbriar Cologne,$30.00 - $80.00,,
Fragrance,Caswell-Massey,Woodgrain Sandalwood Cologne,$30.00 - $80.00,,
Fragrance,Pete & Pedro,Rebel Eau de Parfum Fragrance Cologne For Men,$50.00,,
Fragrance,Rosy & Earnest,Fragrance Discovery Set,$28.00,4.8,51.0
Fragrance,REUZEL,Ultra-Moisturizing Brushless Shave Cream,$14.25,4.8,201.0
Fragrance,REUZEL,Liquid Death Severed Head Clay Pomade,$18.36,4.7,97.0
Fragrance,Caswell-Massey,Heritage Cologne Discovery Set,$90.00,,
Fragrance,Caswell-Massey,Iconic Discovery Set,$90.00,,
Fragrance,Forte Series,Protagonist Eau De Parfum,$119.95,,
Fragrance,Forte Series,Antagonist Eau de Parfum,$119.95,5.0,3.0
Fragrance,TABBEAU,Matcha Rush Eau de Parfum,$40.00 - $145.00,,
Fragrance,TABBEAU,Stamen Blues Eau de Parfum,$40.00 - $145.00,,
Fragrance,TABBEAU,Pistachio Éclat Eau de Parfum,$40.00 - $145.00,,
Fragrance,APOTHEKE,"White Vetiver Pura Smart Scent Fragrance Refill, Set of 2",$36.00,4.6,7.0
Fragrance,APOTHEKE,Earl Grey Bitters Pura Smart Scent Fragrance Refill Set,$36.00,4.5,2.0
Fragrance,APOTHEKE,Sea Salt Grapefruit Pura Smart Scent Fragrance Refill Set,$36.00,4.6,5.0
Fragrance,Particle for Men,Gravité Cologne For Men,$89.00,4.9,3645.0
Fragrance,Particle for Men,Particle Gravite Bundle For Men,$109.00,4.8,21.0
Fragrance,ASCENTION Parfums,Ascent to Courage Imbued in Citrine Eau de Parfum,$90.00,,
Fragrance,ASCENTION Parfums,Ascent to Enchant Imbued in Rainbow Moonstone Eau de Parfum Elixir,$29.25 - $101.25,5.0,1.0
Fragrance,ASCENTION Parfums,Ascent to Love Imbued in Rose Quartz Eau de Parfum Elixir,$29.25 - $101.25,5.0,2.0
Fragrance,ASCENTION Parfums,Ascent to Inspire Imbued in Amazonite Eau de Parfum Elixir,$29.25 - $101.25,3.7,3.0
Fragrance,ASCENTION Parfums,Ascent to Detox Imbued in Smoky Quartz Eau de Parfum,$90.00,,
Fragrance,ASCENTION Parfums,Ascent to Prosperity Imbued in Green Aventurine Eau de Parfum,$90.00,5.0,1.0
Fragrance,ASCENTION Parfums,Ascent to Peace Imbued in Amethyst Eau de Parfum,$90.00,,
Fragrance,ASCENTION Parfums,The Scent Sanctuary Collection,$49.00,,
Fragrance,ASCENTION Parfums,The Scent Spell Collection,$49.00,,
Fragrance,JB Skrub,Body Wash & Body Spray Duo for Tweens and Teens,$39.00,,
Fragrance,JB Skrub,Travel-Size Face & Body Set for Tweens and Teens,$30.00,,
Fragrance,MUHLE,Organic Aftershave Balm,$28.00,,
Fragrance,CRVFT ,Men's Candle,$20.00,5.0,1.0
Fragrance,MUHLE,Styptic Pencil,$8.00,,
Fragrance,Vahy,Isle of Blanc Perfume,$175.00,,
Fragrance,Vahy,Luna Perfume,$175.00,,
Fragrance,Vahy,Tarkine Perfume,$175.00,,
Fragrance,Vahy,Ember Haze Perfume,$175.00,,
Fragrance,Vahy,Desert Nomad Perfume,$175.00,,
Fragrance,Vahy,Isle of Blanc Travel Spray,$38.00,1.0,1.0
Fragrance,Vahy,Midnight Ruze Perfume,$175.00,,
Fragrance,Vahy,Neon Neroli Perfume,$175.00,1.0,1.0
Fragrance,Vahy,Midnight Ruze Travel Spray,$38.00,,
Fragrance,Vahy,Tarkine Travel Spray,$38.00,,
Fragrance,Vahy,Luna Travel Spray,$38.00,,
Fragrance,Vahy,Neon Neoroli Travel Spray,$38.00,,
Fragrance,Vahy,Desert Nomad Travel Spray,$38.00,1.0,1.0
Fragrance,Vahy,Ember Haze Travel Spray,$38.00,,
Fragrance,Vahy,Balanced Encounter Set - Dawn,$45.00,,
Fragrance,Vahy,Balanced Encounter Set - Dusk,$45.00,,
Fragrance,REUZEL,RR Fine Fragrance Clean & Fresh,$19.00,4.5,91.0
Fragrance,REUZEL,Aftershave Original Fragrance,$12.95,4.8,141.0
Fragrance,REUZEL,Solid Cologne Balm Wood & Spice,$13.75,4.7,169.0
Fragrance,REUZEL,Aftershave Wood & Spice Fragrance,$12.95,4.8,161.0
Fragrance,Natura,Cacau Frescor Body Mist – Light Sweet Citrus Fragrance with Brazilian Cacao,$40.00,,
Fragrance,Natura,Brazil Nut Body Mist Frescor – Citrus‑Woody Eau de Toilette Spray for All‑Over Fragrance,$40.00,5.0,2.0
Fragrance,Natura,"Passion Fruit Body Mist – Fresh, Fruity Fragrance for Everyday Freshness",$40.00,4.0,2.0
Fragrance,Natura,Açaí Frescor Body Mist – Tropical Fruity Fragrance for Daily Freshness,$40.00,,
Fragrance,Decorté,Kimono Yui Eau De Toilette,$25.60,4.8,16.0
Fragrance,Decorté,Kimono Kihin Eau De Toilette,$25.60,4.7,15.0
Fragrance,Decorté,Kimono Urara Eau De Toilette,$25.60,4.8,16.0
Fragrance,Decorté,Kimono Tsuya Eau De Toilette,$25.60,4.9,14.0
Fragrance,Particle for Men,Varros Cologne For Men,$129.00,4.9,86.0
Fragrance,Malibu Apothecary,Cannon Beach | Birch Candle,$31.50,5.0,2.0
Fragrance,Malibu Apothecary,Positano | Neroli + Orange Blossom Candle,$31.50,,
Fragrance,Malibu Apothecary,La Dolce Vita Candle Set,$77.00,,
Fragrance,Malibu Apothecary,Amalfi | Basil + Arugula Candle,$31.50,5.0,1.0
Fragrance,Malibu Apothecary,Capri | Lemon Peel + Sage Candle,$31.50,,
Fragrance,Cayla Gray,Layering Bundle,$85.00,,
Fragrance,Jack Henry,Frequency Eau de Parfum,$125.00,,
Fragrance,Jack Henry,Balance Eau de Parfum,$35.00 - $125.00,,
Fragrance,Jack Henry,Karma Eau de Parfum,$125.00,,
Fragrance,Cayla Gray,Fragrance Discovery Kit,$28.00,5.0,2.0
Fragrance,Cayla Gray,Water the Perfume,$90.00,5.0,1.0
Fragrance,Cayla Gray,Petals the Perfume,$90.00,,
Fragrance,Cayla Gray,Velvet The Perfume,$90.00,5.0,1.0
Fragrance,Cayla Gray,Cozy the Perfume,$90.00,5.0,1.0
Fragrance,Cayla Gray,Hearth the Perfume,$90.00,5.0,1.0
Fragrance,Cayla Gray,Hearth the Perfume Oil,$40.00,,
Fragrance,Cayla Gray,Velvet The Perfume Oil,$40.00,,
Fragrance,Cayla Gray,Water the Perfume Oil,$40.00,,
Fragrance,Cayla Gray,Petals the Perfume Oil,$40.00,5.0,1.0
Fragrance,Makari,Royal Rose Perfume,$25.00,4.2,10.0
Fragrance,Malibu Apothecary,ScentSolution Mini + Fragrance Discovery Set,$79.80,,
Fragrance,Malibu Apothecary,Matte Black Votive Candle,$16.00,3.7,6.0
Fragrance,Cayla Gray,Cozy the Perfume Oil,$40.00,5.0,3.0
Fragrance,Cayla Gray,Vanilla Dreams Everything Spray,$20.00,,
Fragrance,Hawkins & Brimble,Fragrance Gift Set Box,$60.00,,
Fragrance,Makari,Royal Oud Perfume,$25.00,3.9,12.0
Fragrance,Malibu Apothecary,Clear Gloss x Blue Candle,$31.50,,
Fragrance,Malibu Apothecary,Mini Matte Black Candle,$17.50,5.0,1.0
Fragrance,Malibu Apothecary,Iridescent Pink Candle,$31.50,5.0,1.0
Fragrance,Malibu Apothecary,Aroma Diffuser,$62.30 - $157.50,,
Fragrance,Malibu Apothecary,Matte Black Candle,$31.50 - $45.00,5.0,1.0
Fragrance,Malibu Apothecary,Votive Discovery Set,$26.60,5.0,1.0
Fragrance,Malibu Apothecary,Soleil Roller Parfum,$25.20,5.0,1.0
Fragrance,Malibu Apothecary,Eau de Parfum,$44.10,5.0,3.0
Fragrance,Baxter of California,Valley Mist Eau de Parfum,$98.00,,
Fragrance,Baxter of California,Canyon Incense Eau de Parfum,$98.00,,
Fragrance,Baxter of California,Pacific Cannabis Eau de Parfum,$98.00,,
Fragrance,Baxter of California,After Shave Balm,$21.00,4.7,15.0
Fragrance,Laundry Sauce,Performance Laundry Fabric Softener,$25.00,,
Fragrance,Laundry Sauce,Luxury Scented Dryer Sheets,$25.00,,
Fragrance,Laundry Sauce,Fabric Refresher Spray,$35.00,,
Fragrance,Laundry Sauce,Advanced In Wash Scent Booster,$25.00,,
Fragrance,APOTHEKE,Charcoal 3-Wick Scented Candle,$67.20,4.9,108.0
Fragrance,APOTHEKE,White Vetiver 3-Wick Scented Candle,$67.20,5.0,31.0
Fragrance,APOTHEKE,Sea Salt Grapefruit 3-Wick Scented Candle,$67.20,5.0,24.0
Fragrance,Blu Atlas,Atlantis Eau De Parfum,$100.00,,
Fragrance,Anthony,After Shave Balm,$24.00,4.5,6.0
Fragrance,Nopalera,Flor de Madera Fragrance Ritual,$64.40,3.0,1.0
Fragrance,Tricoci,Hair & Body Perfume,$39.00,5.0,1.0
Fragrance,Nopalera,Bosque Místico Fragrance Ritual,$64.40,5.0,2.0
Fragrance,Nopalera,Dulce de Cuerpo Fragrance Ritual,$64.40,,
Fragrance,APOTHEKE,Elderflower Sugar Reed Diffuser,$48.00,,
Fragrance,APOTHEKE,Elderflower Sugar Classic Scented Candle,$46.00,5.0,2.0
Fragrance,Rosy & Earnest,Pistachio Delight Eau de Parfum,$35.70 - $125.00,4.1,40.0
Fragrance,Rosy & Earnest,Vanilla Rum Royal Eau de Parfum,$35.70 - $125.00,4.6,43.0
Fragrance,REUZEL,Hair & Cologne Balm Try Me Kit,$53.20,,
Fragrance,REUZEL,Wood & Spice Beard Bundle Trio,$49.65,,
Fragrance,Taylor of Old Bond Street,Jermyn Street Collection Cologne,$63.99,,
Fragrance,Taylor of Old Bond Street,Jermyn Street Collection Aftershave Cream,$27.99,,
Fragrance,Taylor of Old Bond Street,Eton College Collection Aftershave Lotion,$59.99,,
Fragrance,Who Is Elijah,Electric Soul Eau de Parfum,$45.00 - $169.00,,
Fragrance,Who Is Elijah,Rebel Rose Eau de Parfum,$45.00 - $169.00,5.0,1.0
Fragrance,Who Is Elijah,Chemical Addiction Eau de Parfum,$45.00 - $169.00,,
Fragrance,Who Is Elijah,Poetic Dance Eau de Parfum,$55.00 - $169.00,,
Fragrance,Who Is Elijah,Cherry Fiesta Eau de Parfum,$55.00 - $169.00,,
Fragrance,Who Is Elijah,Muse Eau de Parfum,$55.00 - $169.00,,
Fragrance,Who Is Elijah,His|Her Eau de Parfum,$45.00 - $169.00,,
Fragrance,Who Is Elijah,Ocean Eyes Eau de Parfum,$45.00 - $169.00,,
Fragrance,Who Is Elijah,Morning After Eau de Parfum,$45.00 - $169.00,,
Fragrance,Taylor of Old Bond Street,Bay Rum After Shave Tonic Cologne,$43.99,,
Fragrance,Acca Kappa,1869 Eau de Cologne,$99.00,,
Fragrance,Acca Kappa,White Moss Eau de Parfum,$110.00 - $160.00,,
Fragrance,Acca Kappa,White Moss Eau de Cologne,$50.00 - $99.00,,
Fragrance,Acca Kappa,Dolce Treviso Eau de Parfum,$160.00,,
Fragrance,Acca Kappa,Myscent Eau de Parfum,$160.00,,
Fragrance,Acca Kappa,Sakura Tokyo Eau de Parfum,$160.00,,
Fragrance,Acca Kappa,Tilia Cordata Eau de Parfum,$160.00,,
Fragrance,Acca Kappa,Calycanthus Eau de Parfum,$160.00,1.0,1.0
Fragrance,Acca Kappa,Pepe Rosa & Arancio Amaro Eau de Parfum,$160.00,,
Fragrance,Acca Kappa,1869 Eau de Parfum,$160.00,,
Fragrance,APOTHEKE,Tomato Tarragon Specialty 2-Wick Scented Concrete Candle,$43.20,4.8,5.0
Fragrance,APOTHEKE,Lemongrass and Neroli Specialty 2-Wick Scented Concrete Candle,$43.20,,
Fragrance,APOTHEKE,Holy Basil and Rosewater Specialty 2-Wick Scented Concrete Candle,$43.20,5.0,5.0
Fragrance,Acca Kappa,Green Mandarin Eau de Cologne,$99.00,,
Fragrance,Rosy & Earnest,Be Rosy Eau de Parfum,$35.70 - $125.00,4.4,23.0
Fragrance,Rosy & Earnest,Be Earnest Eau de Parfum,$35.70 - $125.00,4.7,20.0
Fragrance,Vitruvi,Sleep Air Scent Refill,$34.99,,
Fragrance,Vitruvi,Warm Vanilla Air Scent Refill,$34.99,,
Fragrance,Vitruvi,Cloud Humidifier,$244.99,,
Fragrance,Vitruvi,Zest for Life Push Scent Refill,$17.99,,
Fragrance,Vitruvi,Spruce Essential Oil,$14.99,,
Fragrance,Vitruvi,Forest Frost Air Scent Refill,$34.99,,
Fragrance,Vitruvi,Forest Rain Push Scent Refill,$17.99,,
Fragrance,Vitruvi,Essentials Oil Kit,$59.99,,
Fragrance,Vitruvi,Boost Air Scent Refill,$34.99,,
Fragrance,Vitruvi,Stone Diffuser,$129.99,,
Fragrance,Vitruvi,Pacific Air Scent Refill,$34.99,,
Fragrance,Vitruvi,Sweet Cherry Push Scent Refill,$17.99,,
Fragrance,Vitruvi,Vanilla Mint Push Scent Refill,$17.99,,
Fragrance,Vitruvi,Rosy Glow Air Scent Refill,$34.99,,
Fragrance,Vitruvi,Grapefruit Essential Oil,$14.99,,
Fragrance,Vitruvi,Bergamot Essential Oil,$19.99,,
Fragrance,Vitruvi,Cleaning Tablets,$21.99,,
Fragrance,Vitruvi,Lavender Essential Oil,$18.99,,
Fragrance,Vitruvi,Push Plug-In Diffuser,$24.99,,
Fragrance,Vitruvi,Air Waterless Diffuser,$149.99,,
Fragrance,Decorté,Kimono Rin Eau De Toilette,$25.60 - $64.00,4.9,8.0
Fragrance,Root Candles,Seeking Balance Aromatherapy Candle - Energize - Rosemary Eucalyptus,$14.99 - $49.99,,
Fragrance,Root Candles,Seeking Balance Aromatherapy Candle -Illuminate - Juniper Rosewood,$14.99 - $49.99,,
Fragrance,Root Candles,Seeking Balance Recover - Sandalwood & Sage Aromatherapy Candle,$25.99 - $49.99,,
Fragrance,Root Candles,Seeking Balance Empower - Lavandin & Patchouli Aromatherapy Candle,$14.99 - $49.99,,
Fragrance,Root Candles,Seeking Balance Uplift - Lemon & Bergamot Aromatherapy Candle,$25.99 - $49.99,2.0,1.0
Fragrance,Root Candles,Seeking Balance Renew - Seaside Cypress & Cedar Leaf Aromatherapy Candle,$25.99 - $49.99,,
Fragrance,Root Candles,Seeking Balance Soothe - Bay Leaf & Birch Aromatherapy Candle,$25.99 - $49.99,,
Fragrance,Root Candles,Seeking Balance Seduce - Patchouli & Anise Aromatherapy Candle,$14.99 - $49.99,,
Fragrance,Root Candles,Seeking Balance Aromatherapy Candle - Relax - Geranium Lavender,$14.99 - $49.99,,
Fragrance,Root Candles,Seeking Balance Rest - Chamomile & Eucalyptus Aromatherapy Candle,$25.99 - $49.99,,
Fragrance,Root Candles,Seeking Balance Awaken - Basil & Lime Aromatherapy Candle,$14.99 - $49.99,,
Fragrance,Root Candles,Seeking Balance Relieve - Eucalyptus Menthol Aromatherapy Candle,$25.99 - $49.99,,
Fragrance,Leverden,Bamboo Forest Relaxation Scented Candle,$85.00,5.0,7.0
Fragrance,Leverden,Bushman candle Energy Scented Candle,$85.00,5.0,10.0
Fragrance,Leverden,Valley of Roses Self-love Scented Candle,$85.00,5.0,8.0
Fragrance,Leverden,Shaman Purification Scented Candle,$85.00,5.0,7.0
Fragrance,SPONGELLE,Florica Collection Hand Poured Candle Mystic Rose,$46.00,,
Fragrance,SPONGELLE,Florica Collection Mystic Rose Eau De Toilette,$29.00,,
Fragrance,Leverden,Bushman Candle Myrrh Protection Bar,$35.00,5.0,7.0
Fragrance,Taylor of Old Bond Street,Sandalwood Cologne,$58.99,,
Fragrance,Taylor of Old Bond Street,St. James Fragrance Cologne Aftershave,$59.99,,
Fragrance,Taylor of Old Bond Street,Tobacco Leaf Aftershave Lotion,$59.99,,
Fragrance,Root Candles,Legacy Collection Luxury Scented Candle - Myrrh & Honey,$29.99,,
Fragrance,Root Candles,Legacy Collection Luxury Scented Candle - Bayberry,$29.99,,
Fragrance,Root Candles,Legacy Collection Luxury Scented Candle - Golden Hour,$29.99,,
Fragrance,Root Candles,Legacy Collection Luxury Scented Candle - Sugared Grapefruit,$29.99,,
Fragrance,Root Candles,Legacy Collection Luxury Scented Candle - Hosta,$29.99,,
Fragrance,Root Candles,Legacy Collection Luxury Scented Candle - Lavender Vanilla,$29.99,,
Fragrance,Root Candles,Legacy Collection Luxury Scented Candle - Citron & Bergamot,$29.99,,
Fragrance,Root Candles,Legacy Collection Luxury Scented Candle - Japanese Cedarwood,$29.99,,
Fragrance,Root Candles,Legacy Collection Luxury Scented Candle - French Vanilla,$29.99,,
Fragrance,Root Candles,Legacy Collection Luxury Scented Candle - Fresh Floret,$29.99,,
Fragrance,Root Candles,Legacy Collection Luxury Scented Candle - Spiced Orchard,$29.99,,
Fragrance,Root Candles,Legacy Collection Luxury Scented Candle - Salt Mist & Sand,$29.99,,
Fragrance,Root Candles,Legacy Collection Luxury Scented Candle - Peppermint Bark,$29.99,,
Fragrance,Root Candles,Legacy Collection Luxury Scented Candle - Coastal Sunrise,$29.99,,
Fragrance,Root Candles,Legacy Collection Luxury Scented Candle - Tobacco Vanilla,$29.99,,
Fragrance,Root Candles,Legacy Collection Luxury Scented Candle - Pumpkin Spice,$29.99,,
Fragrance,Root Candles,Legacy Collection Luxury Scented Candle - Timberland Retreat,$29.99,,
Fragrance,Root Candles,Legacy Collection Luxury Scented Candle - Strawberry Fields,$29.99,,
Fragrance,Root Candles,Legacy Collection Luxury Scented Candle - Seaside Harbor,$29.99,,
Fragrance,Root Candles,Legacy Collection Luxury Scented Candle - Sandalwood,$29.99,,
Fragrance,Root Candles,Legacy Collection Luxury Scented Candle - Hollyberry,$29.99,,
Fragrance,Root Candles,Legacy Collection Luxury Scented Candle - Midnight Dahlia,$29.99,,
Fragrance,Root Candles,Legacy Collection Luxury Scented Candle - Aromatic Herbs,$29.99,,
Fragrance,Root Candles,Legacy Collection Luxury Scented Candle - Tangerine Lemongrass,$29.99,,
Fragrance,Root Candles,Legacy Collection Luxury Scented Candle - Mulled Cider,$29.99,,
Fragrance,Root Candles,Legacy Collection Luxury Scented Candle - Tea Leaf & Honey,$29.99,,
Fragrance,APOTHEKE,Kindling Classic Scented Candle,$36.80,4.3,6.0
Fragrance,Root Candles,Legacy Collection Luxury Scented Candle - Winter Balsam,$29.99,,
Fragrance,APOTHEKE,Kindling Petite Scented Candle,$21.25,,
Fragrance,Root Candles,Legacy Collection Luxury Scented Candle - Waterline,$29.99,,
Fragrance,Root Candles,Legacy Collection Luxury Scented Candle - Bourbon Pear,$29.99,,
Fragrance,Root Candles,Legacy Collection Luxury Scented Candle - English Lavender,$29.99,,
Fragrance,Taylor of Old Bond Street,Mr Taylor Aftershave Balm,$27.99,,
Fragrance,Taylor of Old Bond Street,No.74 Original Fragrance Cologne Aftershave,$59.99,,
Fragrance,Taylor of Old Bond Street,No.74 Victorian Lime Fragrance Cologne Aftershave,$59.99,,
Fragrance,APOTHEKE,Floral Candle Making Kit,$62.40,,
Fragrance,APOTHEKE,Woody Candle Making Kit,$62.40,,
Fragrance,APOTHEKE,Citrus Candle Making Kit,$62.40,,
Fragrance,Taylor of Old Bond Street,Sandalwood Alcohol-Free Aftershave Lotion,$29.99,,
Fragrance,PURSONIC,100% Pure Essential Aromatherapy Oils,$34.99,,
Fragrance,PURSONIC,100% Pure & Natural Fractionated Coconut Oil,$16.99 - $21.99,,
Fragrance,PURSONIC,100% Pure & Natural Lavender Essential Oils,$19.99,,
Fragrance,PURSONIC,Aromatherapy Essential Oil Gift Set,$29.99,,
Fragrance,PURSONIC,100% Pure Natural Essence Essential Oils,$14.95,,
Fragrance,PURSONIC,100% Pure & Natural Eucalyptus Essential Oils,$19.99,,
Fragrance,PURSONIC,100% Pure & Natural Peppermint Essential Oils,$19.99,,
Fragrance,PURSONIC,Aromatherapy Essential Oils Gift Set,$29.99,,
Fragrance,PURSONIC,100% Pure & Natural Tea Tree Essential Oils,$19.99,,
Fragrance,Sauce Beauty,Guac Twist Hair Fragrance,$13.49,,
Fragrance,Sauce Beauty,Goddess Hair Fragrance,$13.49,,
Fragrance,Sauce Beauty,Rouge Cloud Hair Fragrance,$13.49,,
Fragrance,Sauce Beauty,Jasmine Bliss Hair Fragrance,$13.49,,
Fragrance,Root Candles,Legacy Collection Luxury Scented Candle - Amber & Oak,$21.99 - $49.99,,
Fragrance,Root Candles,Legacy Collection Luxury Scented Candle - Blackberry Honey,$21.99 - $49.99,,
Fragrance,Root Candles,Legacy Collection Luxury Scented Candle - Coffee Roastery,$21.99 - $49.99,,
Fragrance,Esha,Midnight Fantasy Body & Hair Perfume Mist,$10.99,,
Fragrance,Esha,Lady In Red Body & Hair Perfume Mist,$10.99,,
Fragrance,Esha,Beyond The Clouds Body & Hair Perfume Mist,$10.99,,
Fragrance,Esha,Warm & Pleasant Body & Hair Perfume Mist,$10.99,,
Fragrance,Esha,Joyful Body & Hair Perfume Mist,$10.99,,
Fragrance,Esha,Summer Tale Body & Hair Perfume Mist,$10.99,,
Fragrance,Esha,Caribbean Sunrise Body & Hair Perfume Mist,$10.99,,
Fragrance,Esha,Cloud Nine Body & Hair Perfume Mist,$10.99,,
Fragrance,Esha,Star Field Body & Hair Perfume Mist,$10.99,,
Fragrance,Esha,Love Freedom Body & Hair Perfume Mist,$10.99,,
Fragrance,APOTHEKE,Hinoki Lavender Classic Scented Candle,$36.80,4.8,37.0
Fragrance,APOTHEKE,Hinoki Lavender Reed Diffuser,$48.00,4.9,22.0
Fragrance,Shaquille O'Neal Fragrance,Eau de Toilette Spray,$55.00,5.0,5.0
Fragrance,APOTHEKE,Bestsellers Votive Scented Candle Trio,$48.00,5.0,47.0
Fragrance,APOTHEKE,Fig and Olive Leaf Classic Scented Candle,$36.80,,
Fragrance,APOTHEKE,Fig and Olive Leaf Petite Scented Candle,$21.25,,
Fragrance,Afnan,9 PM Elixir Extrait De Parfum,$50.00,,
Fragrance,Afnan,Oud Rising Eau de Parfum,$60.00,,
Fragrance,Afnan,Edict Ouddiction Eau De Parfum,$125.00,,
Fragrance,Afnan,Turathi Electric Eau De Parfum,$50.00,,
Fragrance,Afnan,Kiaana Angel Pour Femme Eau De Parfum,$50.00,,
Fragrance,Afnan,Lynked Forever Eau De Parfum,$50.00,,
Fragrance,Afnan,Delicious Bouquet Eau De Parfum,$50.00,,
Fragrance,Afnan,Supremacy Gala Eau De Parfum,$60.00,,
Fragrance,Afnan,Highness Brown Luxury Eau De Parfum,$100.00,,
Fragrance,Afnan,Tobacco Rush Eau de Parfum for Men,$60.00,,
Fragrance,Afnan,Turathi Blue Eau De Parfum for Men,$50.00,,
Fragrance,Afnan,9 Pm Edition For Men,$50.00,,
Fragrance,TEABLESS,Perfume Body Wash Sage Amber Purple Tea,$27.00,,
Fragrance,Afnan,Edict Amberythme Eau De Parfum,$125.00,,
Fragrance,Afnan,Edict Musctique Eau De Parfum,$125.00,,
Fragrance,TEABLESS,Perfume Body Wash Floral Meadowsweet Tea,$27.00,,
Fragrance,Afnan,9 AM Dive Eau De Parfum,$50.00,,
Fragrance,Afnan,Patchouli On Fire Eau de Parfum for Men,$60.00,,
Fragrance,Afnan,Historic Sahara Extrait De Parfum,$50.00,,
Fragrance,Afnan,Supremacy in Oud Eau De Parfum,$60.00,,
Fragrance,TEABLESS,Perfume Hair & Body Mist Floral Meadowsweet Tea,$27.00,,
Fragrance,TEABLESS,Perfume Body Lotion Floral Meadowsweet Tea,$27.00,,
Fragrance,Afnan,Cherry Bouquet Eau de Parfum,$50.00,,
Fragrance,Afnan,Supremacy Tapis Rouge Eau De Parfum,$60.00,,
Fragrance,TEABLESS,Perfume Body Lotion Lily Musk White Tea,$27.00,,
Fragrance,Afnan,Kiaana Crush Pour Femme Eau De Parfum,$50.00,,
Fragrance,Afnan,Highness Maroon Luxury Eau De Parfum,$100.00,,
Fragrance,Afnan,Mystique Bouquet Eau de Parfum,$50.00,,
Fragrance,Afnan,9 PM Femme Edition Eau De Parfum Spray,$50.00,,
Fragrance,TEABLESS,Perfume Body Wash Lily Musk White Tea,$27.00,,
Fragrance,TEABLESS,Perfume Body Lotion Sage Amber Purple Tea,$27.00,,
Fragrance,Cayla Gray,Slumber the Perfume,$90.00,,
Fragrance,Afnan,9 AM Pour Femme Eau De Parfum,$50.00,,
Fragrance,OLFACTORY X,Blackcurrant + Vanilla Eau de Parfum,$55.00,,
Fragrance,ARABIAN CREST DUBAI,Ranjha Eau de Parfum,$112.50,,
Fragrance,ARABIAN CREST DUBAI,Rooh Eau de Parfum,$112.50,,
Fragrance,ARABIAN CREST DUBAI,Heer Eau de Parfum,$112.50,,
Fragrance,ARABIAN CREST DUBAI,Yaar Eau de Parfum,$112.50,,
Fragrance,Kumbra With Love,Sunlit Citrus Eau de Parfum,$50.00,,
Fragrance,OLFACTORY X,Bulgarian Rose + Vetiver Eau de Parfum,$55.00,,
Fragrance,Kumbra With Love,Roses of Love Eau de Parfum,$50.00,,
Fragrance,ARABIAN CREST DUBAI,Mirza Eau de Parfum,$112.50,,
Fragrance,OLFACTORY X,Bergamot + Blossom Eau de Parfum,$55.00,,
Fragrance,OLFACTORY X,Hazelnut + Whipped Cream Eau de Parfum,$55.00,,
Fragrance,OLFACTORY X,Mint + Apricot Eau de Parfum,$55.00,,
Fragrance,OLFACTORY X,Bergamot + Leaf Eau de Parfum,$55.00,,
Fragrance,Kumbra With Love,Ocean Musk Eau de Parfum,$50.00,,
Fragrance,OLFACTORY X,Saffron + Amber Eau de Parfum,$55.00,,
Fragrance,ARABIAN CREST DUBAI,Jind Eau de Parfum,$112.50,,
Fragrance,OLFACTORY X,Honey + Hay Eau de Parfum,$55.00,,
Fragrance,OLFACTORY X,Sea Salt + Vetiver Eau de Parfum,$55.00,,
Fragrance,Kumbra With Love,Cedar Creme Eau de Parfum,$50.00,,
Fragrance,OLFACTORY X,Lemon + Musk Eau de Parfum,$55.00,,
Fragrance,OLFACTORY X,Green Tea + Orange Eau de Parfum,$55.00,,
Fragrance,Kumbra With Love,Tonka Creme Eau de Parfum,$50.00,,
Fragrance,OLFACTORY X,Mint + Sage Eau de Parfum,$55.00,,
Fragrance,Kumbra With Love,Crimson Ember Eau de Parfum,$50.00,5.0,1.0
Fragrance,Kumbra With Love,Gingerwood Eau de Parfum,$50.00,,
Fragrance,Kumbra With Love,Morning Meadow Eau de Parfum,$50.00,,
Fragrance,Kumbra With Love,Berry Muse Eau de Parfum,$50.00,,
Fragrance,Kumbra With Love,Forest Ember Eau de Parfum,$50.00,,
Fragrance,Kumbra With Love,Desert Oud & Spice Eau de Parfum,$50.00,,
Fragrance,Kumbra With Love,Marina Zest Eau de Parfum,$50.00,,
Fragrance,Kumbra With Love,Barbe Verte Eau de Parfum,$50.00,,
Fragrance,Johnny B. Hair Care,After Shave Spray - A.M.,$20.00,,
Fragrance,Johnny B. Hair Care,After Shave Spray - Noon,$20.00,,
Fragrance,Johnny B. Hair Care,After Shave Spray - P.M.,$20.00,,
Fragrance,Johnny B. Hair Care,More Than A Feeling After Shave Set,$60.00,,
Fragrance,Johnny B. Hair Care,Shave Overnight Toiletry Bag Set,$48.00,,
Fragrance,Johnny B. Hair Care,After Shave Spray - Midnite,$20.00,,
Fragrance,Johnny B. Hair Care,Balm After Shave,$24.00 - $50.00,,
